Text,Token,Start Index,End Index,Entity Label,Knowledge Base ID
Animoca Brands is driving digital property rights via NFTs and gaming to help build the open metaverse.,Animoca Brands,0,14,ORG,
"Bitwarden provides an open-source password management solutions for individuals, teams, and business organizations.",Bitwarden,0,9,PERSON,
21.co is the world’s leader in providing access to crypto through simple and easy to use products. Parent company of 21Shares &amp; Amun.,21.co,0,5,ORG,
21.co is the world’s leader in providing access to crypto through simple and easy to use products. Parent company of 21Shares &amp; Amun.,21Shares &amp,117,130,ORG,
21.co is the world’s leader in providing access to crypto through simple and easy to use products. Parent company of 21Shares &amp; Amun.,Amun,132,136,PERSON,
"Mysten Labs develops tools that make web3 secure, reliable, and ready for mass adoption.",Mysten Labs,0,11,PERSON,
Animoca Brands is driving digital property rights via NFTs and gaming to help build the open metaverse.,Animoca Brands,0,14,ORG,
"GroMo is a FinTech marketplace helping users sell financial products such as loans, insurance, and investments.",FinTech,11,18,ORG,
ZippMat is a SCaaS enterprise that provides a one-stop solution for all supply chain management needs of construction companies.,ZippMat,0,7,ORG,
ZippMat is a SCaaS enterprise that provides a one-stop solution for all supply chain management needs of construction companies.,one,46,49,CARDINAL,
Skyroot Aerospace is an aerospace manufacturer and launch service provider developing launch vehicles for cost-effective access to space.,Skyroot Aerospace,0,17,ORG,
"Pezesha is a digital financial marketplace that connects SMBs to working capital, float financing, and LPO financing.",LPO,103,106,ORG,
1mg is an online pharmacy network platform and generic medicine engine.,1,0,1,CARDINAL,
SkyBridge Capital is a global alternative investment firm.,SkyBridge Capital,0,17,ORG,
"Suite42 provides manufacturing products across food staples, food processing, and FMCG industries.",Suite42,0,7,ORG,
Latana is a brand tracking tool that uses advanced data science to ensure reliable and accurate brand insights.,Latana,0,6,ORG,
SeatGeek operates a mobile-focused ticket platform and search engine that lets fans buy and sell tickets for events.,SeatGeek,0,8,ORG,
Spice AI is creating technology to make artificial intelligence and machine learning more accessible to developers.,Spice AI,0,8,PERSON,
Morse Micro is a semiconductor startup developing Wi-Fi HaLow / 802.11ah chips for the Internet of Things (IoT) market.,Morse Micro,0,11,ORG,
Morse Micro is a semiconductor startup developing Wi-Fi HaLow / 802.11ah chips for the Internet of Things (IoT) market.,Wi-Fi HaLow,50,61,ORG,
Aktis Oncology is a biotechnology company discovering and developing a novel class of targeted radiopharmaceuticals.,Aktis Oncology,0,14,ORG,
Mobile-based operating system to manage construction &amp; architectural projects,Mobile,0,6,GPE,
"Digital Diagnostics is an AI diagnostics company that transforms the quality, accessibility, and affordability of healthcare.",Digital Diagnostics,0,19,ORG,
"Digital Diagnostics is an AI diagnostics company that transforms the quality, accessibility, and affordability of healthcare.",healthcare,114,124,ORG,
Duplo is modernizing B2B payments in Africa,Duplo,0,5,PERSON,
Duplo is modernizing B2B payments in Africa,Africa,37,43,LOC,
"FinAGG is a digital credit card for suppliers, distributors and retailers that lubricates the flow of goods &amp; payments in the Supply Chain.",the Supply Chain,126,142,LOC,
Vector Database for Production-ready AI,AI,37,39,ORG,
"Petfolk is a veterinary healthcare company that provides a connected community for today's vets, pets, and pet owners.",Petfolk,0,7,GPE,
"Petfolk is a veterinary healthcare company that provides a connected community for today's vets, pets, and pet owners.",today,83,88,DATE,
Albedo designs and operates satellites that capture imagery at a higher resolution.,Albedo,0,6,GPE,
Digital Mental Health Games,Digital Mental Health Games,0,27,ORG,
"SnappRetail is a complete retail operating platform that empowers traditional trade retailers in Pakistan, to grow their margin and revenue.",SnappRetail,0,11,ORG,
"SnappRetail is a complete retail operating platform that empowers traditional trade retailers in Pakistan, to grow their margin and revenue.",Pakistan,97,105,GPE,
"Bond Pet Foods makes pet food from real animal protein, without the animal by working with biotechnology.",Bond Pet Foods,0,14,ORG,
Revolving Games is a mobile game studio that creates and delivers Web3 experiences for gamers.,Revolving Games,0,15,ORG,
Jar is an investment tech startup that allows users to save money and invest in digital gold.,Jar,0,3,PERSON,
Muck Rack is a public relations management platform that enables organizations to connect with journalists to generate media coverage.,Muck Rack,0,9,PERSON,
"Kasisto's enables financial institutions to service, engage, and acquire customers.",Kasisto,0,7,ORG,
"Luminovo is a SaaS provider building the electronics operating system for EMS, OEMs, and distributors to accelerate technological progress.",Luminovo,0,8,ORG,
"Luminovo is a SaaS provider building the electronics operating system for EMS, OEMs, and distributors to accelerate technological progress.",EMS,74,77,ORG,
First Therapeutic Device For The Treatment Of Vertigo.,First,0,5,ORDINAL,
Fair Square Medicare provides a consumer-friendly way for seniors to buy health insurance.,Fair Square Medicare,0,20,FAC,
Graas is a provider of e-commerce solutions.,Graas,0,5,ORG,
Stake Properties is a digital real estate investment platform that helps its users invest in income-generating properties.,Stake Properties,0,16,PERSON,
PriceOye is an eCommerce platform that allows users to compare prices for consumer electronics products.,PriceOye,0,8,ORG,
"Hexarad is a tech-enabled teleradiology that supports the remote reporting of medical scans such as CTs, MRIs and X-rays.",Hexarad,0,7,PERSON,
"Hexarad is a tech-enabled teleradiology that supports the remote reporting of medical scans such as CTs, MRIs and X-rays.",CTs,100,103,ORG,
Ceezer is a digital-first carbon bank that gives companies access to and guidance through the complex voluntary carbon market.,Ceezer,0,6,PERSON,
"3T Biosciences is an immunotherapy company headquartered in Menlo Park, California.",Menlo Park,60,70,GPE,
"3T Biosciences is an immunotherapy company headquartered in Menlo Park, California.",California,72,82,GPE,
Propseller is a real estate agency that offers property owners a reliable way to sell by combining in-house agents with technology.,Propseller,0,10,PERSON,
"Odyssey Energy Solutions is an industry platform to simplify, streamline, and reduce the costs of developing and financing energy projects.",Odyssey Energy Solutions,0,24,ORG,
Harmonic Discovery operates as a pharmaceutical company that develops a platform that combines computing and experimentation.,Harmonic Discovery,0,18,ORG,
Exponent Energy focuses on developing fast charging technology for electric vehicles.,Exponent Energy,0,15,ORG,
ArsenalBio is a programmable cell therapy company that offers advanced CAR T-cell therapies for solid tumors.,ArsenalBio,0,10,ORG,
ArsenalBio is a programmable cell therapy company that offers advanced CAR T-cell therapies for solid tumors.,CAR,71,74,ORG,
Arize AI offers a platform that explains and troubleshoots production AI.,AI,70,72,ORG,
"Ubie is a Tokyo based health-tech startup, that provides AI-based healthcare products, hospital SaaS products, and AI symptom checkers.",Ubie,0,4,ORG,
"Ubie is a Tokyo based health-tech startup, that provides AI-based healthcare products, hospital SaaS products, and AI symptom checkers.",Tokyo,10,15,GPE,
"Ubie is a Tokyo based health-tech startup, that provides AI-based healthcare products, hospital SaaS products, and AI symptom checkers.",AI,57,59,ORG,
Nitra brings all-in-one finance to the traditional industries of America.,one,20,23,CARDINAL,
Nitra brings all-in-one finance to the traditional industries of America.,America,65,72,GPE,
"Telecom, Forestry, IOT, Sensors, Networking, Analytics, Cloud, Environmental, Green","Telecom, Forestry",0,17,ORG,
"Telecom, Forestry, IOT, Sensors, Networking, Analytics, Cloud, Environmental, Green",IOT,19,22,ORG,
"Telecom, Forestry, IOT, Sensors, Networking, Analytics, Cloud, Environmental, Green","Cloud, Environmental, Green",56,83,WORK_OF_ART,
"RentSpree provides software with a universal tenant screening process, renter management, partnership programs, and rental screening API.",RentSpree,0,9,ORG,
"RentSpree provides software with a universal tenant screening process, renter management, partnership programs, and rental screening API.",API,133,136,ORG,
Wayflyer provides funding and marketing analytics to e-commerce businesses.,Wayflyer,0,8,PERSON,
"PROOF is an NFT platform that provides access to private Discord, early access to the PROOF podcast, and in-person events.",NFT,12,15,ORG,
"PROOF is an NFT platform that provides access to private Discord, early access to the PROOF podcast, and in-person events.",Discord,57,64,GPE,
"Apricity is the world’s first at-home fertility clinic, powered by tech and AI. Less stress and more success",first,24,29,ORDINAL,
"Apricity is the world’s first at-home fertility clinic, powered by tech and AI. Less stress and more success",AI,76,78,GPE,
"H2 Green Steel is a producer of green steel, which involves the use of less carbon dioxide emissions compared to traditional steelmaking.",Green Steel,3,14,ORG,
"H2 Green Steel is a producer of green steel, which involves the use of less carbon dioxide emissions compared to traditional steelmaking.",green steel,32,43,ORG,
"Inworld AI is a creative platform for AI-driven virtual characters, immersive realities, and metaverse spaces.",Inworld AI,0,10,ORG,
"Inworld AI is a creative platform for AI-driven virtual characters, immersive realities, and metaverse spaces.",AI,38,40,ORG,
Glints is Southeast Asia’s largest talent platform for career development and recruitment.,Southeast Asia’s,10,26,LOC,
JenaValve is a medical device company focused on the design and development of innovative transcatheter heart valve solutions,JenaValve,0,9,ORG,
Orna Therapeutics is a biotechnology company that specializes in fully engineered circular RNA therapeutics to treat various diseases.,Orna Therapeutics,0,17,PERSON,
"VTS is a real estate CRM software company bringing together landlords, brokers, and tenants to make deals happen.",VTS,0,3,ORG,
"VTS is a real estate CRM software company bringing together landlords, brokers, and tenants to make deals happen.",CRM,21,24,PRODUCT,
Grey provides virtual global bank accounts for Africans for free to receive and make foreign payments or convert currencies.,Grey,0,4,ORG,
Grey provides virtual global bank accounts for Africans for free to receive and make foreign payments or convert currencies.,Africans,47,55,NORP,
"CodeNotary is a software company providing security technology to make the software supply chains and SBOMs secure, trusted and verifiable.",CodeNotary,0,10,ORG,
Abridge is a medical conversation AI startup that offers an audio-based system to record and summarize medical conversations.,AI,34,36,GPE,
VerifyVASP provides Regulatory Technology (RegTech) solutions to Virtual Assets Service Providers (VASPs) for Travel Rule.,Regulatory Technology,20,41,ORG,
VerifyVASP provides Regulatory Technology (RegTech) solutions to Virtual Assets Service Providers (VASPs) for Travel Rule.,RegTech,43,50,ORG,
VerifyVASP provides Regulatory Technology (RegTech) solutions to Virtual Assets Service Providers (VASPs) for Travel Rule.,Virtual Assets Service Providers,65,97,ORG,
VerifyVASP provides Regulatory Technology (RegTech) solutions to Virtual Assets Service Providers (VASPs) for Travel Rule.,Travel Rule,110,121,PERSON,
Theranica is an Israeli biomedical technology company focused on developing electronic and wireless communication technology.,Theranica,0,9,PERSON,
Theranica is an Israeli biomedical technology company focused on developing electronic and wireless communication technology.,Israeli,16,23,NORP,
marta provides software for the live-in care market that empowers caregivers and helps our seniors to age in dignity.,marta,0,5,GPE,
StarTree is a startup building a platform-as-service version of the Apache Pinot analytics platform.,Apache Pinot,68,80,PRODUCT,
El-Dokan is an enterprise e-commerce software designed for large and growing retail stores in MENA.,El-Dokan,0,8,ORG,
El-Dokan is an enterprise e-commerce software designed for large and growing retail stores in MENA.,MENA,94,98,ORG,
SubsBase offers comprehensive subscription management and billing solutions that help businesses acquire and retain more customers.,SubsBase,0,8,ORG,
Flair makes smart vents and wireless thermostats and advanced software for residential heating and cooling.,Flair,0,5,ORG,
International Payments Identity(IPiD) is a international payments addressing platform.,International Payments Identity(IPiD,0,36,ORG,
Lunar Energy builds clean energy products to deliver home electrification at scale.,Lunar Energy,0,12,ORG,
"Falkon AI is an intelligence platform for marketing, sales, and account management teams.",Falkon AI,0,9,PERSON,
Revolving Games is a mobile game studio that creates and delivers Web3 experiences for gamers.,Revolving Games,0,15,ORG,
Animoca Brands KK support the global strategy of Web3.0 for Japanese intellectual property and content (IP) holders.,Animoca Brands KK,0,17,ORG,
Animoca Brands KK support the global strategy of Web3.0 for Japanese intellectual property and content (IP) holders.,Web3.0,49,55,ORG,
Animoca Brands KK support the global strategy of Web3.0 for Japanese intellectual property and content (IP) holders.,Japanese,60,68,NORP,
Animoca Brands KK support the global strategy of Web3.0 for Japanese intellectual property and content (IP) holders.,IP,104,106,ORG,
Jobbatical is an AI-enabled immigration and relocation platform focused on making immigration easy.,AI,17,19,ORG,
ADT is a security company that provides smart home solutions and business security.,ADT,0,3,ORG,
Delli offers a variety of food and beverages.,Delli,0,5,PERSON,
Carbon Direct combines scientific expertise and financial capital to scale carbon removal and utilization into a major global industry.,Carbon Direct,0,13,PRODUCT,
Pixxel is a space data company that develops a constellation of hyperspectral earth imaging satellites.,Pixxel,0,6,ORG,
Zumper is a software platform that connects people with real estate rental properties.,Zumper,0,6,ORG,
ILiAD is a clinical stage biotechnology company focused on the prevention and treatment of disease caused by Bordetella Pertussis.,ILiAD,0,5,ORG,
ILiAD is a clinical stage biotechnology company focused on the prevention and treatment of disease caused by Bordetella Pertussis.,Bordetella Pertussis,109,129,ORG,
Loopworm is a developer of a technology intended to create a protein diet for fisheries and poultry farms.,Loopworm,0,8,PERSON,
"Tesseract offers commission-free energy; 10x cheaper; 10x better, and 100 percent renewable energy.",10x,41,44,DATE,
"Tesseract offers commission-free energy; 10x cheaper; 10x better, and 100 percent renewable energy.",10x,54,57,DATE,
"Tesseract offers commission-free energy; 10x cheaper; 10x better, and 100 percent renewable energy.",100 percent,70,81,PERCENT,
"CertifyOS is an API-driven platform automating all stages of provider network management: licensing, enrollment, credentialing, monitoring.",API,16,19,ORG,
"CertifyOS is an API-driven platform automating all stages of provider network management: licensing, enrollment, credentialing, monitoring.",enrollment,101,111,GPE,
Belvo is the open finance API platform that enables users to connect their accounts to an app.,Belvo,0,5,ORG,
Belvo is the open finance API platform that enables users to connect their accounts to an app.,API,26,29,ORG,
Shiprocket is an e-commerce shipping platform that enables cost-effective shipping for direct-to-consumer retailers.,Shiprocket,0,10,ORG,
"Zeet is a developer-focused application platform that deploys code or app to AWS, GCP, and other cloud providers.",AWS,77,80,ORG,
"Zeet is a developer-focused application platform that deploys code or app to AWS, GCP, and other cloud providers.",GCP,82,85,ORG,
Zero Emission Industries offers a complete range of hydrogen powered energy systems.,Emission Industries,5,24,ORG,
Qcells provides the key figures that make us the best choice for your investment into a qualified solar solution.,Qcells,0,6,ORG,
"Wondermind helps people care for their mental health via daily content, CPG products, and storytelling.",CPG,72,75,ORG,
"Klavi is a developer of an open finance platform for data aggregation, analytics, and API services.",Klavi,0,5,ORG,
"Klavi is a developer of an open finance platform for data aggregation, analytics, and API services.",API,86,89,ORG,
Solsten is an AI firm engaged in understanding human behavior in the digital world to power the future of customer experience.,Solsten,0,7,PERSON,
Solsten is an AI firm engaged in understanding human behavior in the digital world to power the future of customer experience.,AI,14,16,GPE,
AstriVax,AstriVax,0,8,ORG,
Dian Xiaomi provides one-stop services for global e-commerce sellers.,Dian Xiaomi,0,11,PERSON,
Dian Xiaomi provides one-stop services for global e-commerce sellers.,one,21,24,CARDINAL,
Diveplane develops an AI-based platform that is faster than current off-the-shelf solutions and can train on significantly less data.,Diveplane,0,9,ORG,
Diveplane develops an AI-based platform that is faster than current off-the-shelf solutions and can train on significantly less data.,AI,22,24,GPE,
Xepelin provides financial services for small and medium-sized business.,Xepelin,0,7,GPE,
"Varjo makes advanced VR/XR hardware and software for industrial use, paving the way for a true-to-life metaverse.",Varjo,0,5,ORG,
"Varjo makes advanced VR/XR hardware and software for industrial use, paving the way for a true-to-life metaverse.",VR,21,23,ORG,
"BigPanda offers a platform that helps IT Ops, NOC, and DevOps teams detect, investigate, and resolve IT incidents faster and more easily.",BigPanda,0,8,ORG,
"BigPanda offers a platform that helps IT Ops, NOC, and DevOps teams detect, investigate, and resolve IT incidents faster and more easily.",NOC,46,49,ORG,
"BigPanda offers a platform that helps IT Ops, NOC, and DevOps teams detect, investigate, and resolve IT incidents faster and more easily.",DevOps,55,61,ORG,
EarlySalary.com is a new FinTech start-up in Pune. We are here to help you from being broke.,FinTech,25,32,ORG,
EarlySalary.com is a new FinTech start-up in Pune. We are here to help you from being broke.,Pune,45,49,ORG,
Fervo Energy is a developer of proprietary clean energy technology to generate power from enhanced geothermal systems.,Fervo Energy,0,12,ORG,
"Power Life Science is a patient-friendly platform that provides access to clinical trials by condition, location, and drug type.",Power Life Science,0,18,ORG,
TeamApt is a financial technology company that develops digital banking and payment platform for financial transactions.,TeamApt,0,7,ORG,
Convertedin is an ad automation platform for ecommerce businesses using AI.,Convertedin,0,11,PERSON,
Convertedin is an ad automation platform for ecommerce businesses using AI.,AI,72,74,ORG,
OneSignal is a customer messaging and engagement platform that allows businesses to create meaningful customer connections.,OneSignal,0,9,ORG,
"AdvanCell is radiopharmaceutical firm that has developed the Targeted Alpha Therapy platform technology, a cutting-edge cancer treatment.",AdvanCell,0,9,ORG,
"AdvanCell is radiopharmaceutical firm that has developed the Targeted Alpha Therapy platform technology, a cutting-edge cancer treatment.",the Targeted Alpha Therapy,57,83,ORG,
Protex AI develops an AI-powered proactive health and safety technology that enables an injury-free industrial workplace.,Protex AI,0,9,ORG,
Protex AI develops an AI-powered proactive health and safety technology that enables an injury-free industrial workplace.,AI,22,24,ORG,
Awign is a work fulfillment platform that specializes in the gig workforce and provides last-mile delivery services.,last-mile,88,97,QUANTITY,
Xeneta is an ocean freight rate benchmarking and market intelligence platform and index.,Xeneta,0,6,GPE,
Zywa is the first neobank for teenagers in the Middle East and North Africa region,Zywa,0,4,PERSON,
Zywa is the first neobank for teenagers in the Middle East and North Africa region,first,12,17,ORDINAL,
Zywa is the first neobank for teenagers in the Middle East and North Africa region,the Middle East,43,58,LOC,
Zywa is the first neobank for teenagers in the Middle East and North Africa region,North Africa,63,75,GPE,
"NowNow is a digital banking platform whose mission is to deliver best in class financial services for Agents, Consumers and Businesses.",NowNow,0,6,ORG,
Trek Health builds foundational software that empowers mental health providers.,Trek Health,0,11,ORG,
Carzami is an online platform that solves the hectic process of buying and selling used cars from the comfort of your homes.,Carzami,0,7,ORG,
True Food Kitchen is a 42-unit restaurant and lifestyle brand serving foods crafted to nutritional standards.,42,23,25,CARDINAL,
PeakData is a software platform to identify and analyze key opinion leaders in your therapeutic area.,PeakData,0,8,ORG,
RedStone is a next-generation cross-chain data oracle providing pricing data for financial protocols.,RedStone,0,8,ORG,
Gokomodo is a supply Chain Platform and Services for Agribusiness and Commodities.,Gokomodo,0,8,ORG,
Gokomodo is a supply Chain Platform and Services for Agribusiness and Commodities.,Chain Platform and Services for Agribusiness and Commodities,21,81,ORG,
"We are The Financial Experience Company. We work with FIs, Employers, and Fintechs to delight customers and make money more awesome.",The Financial Experience Company,7,39,ORG,
"We are The Financial Experience Company. We work with FIs, Employers, and Fintechs to delight customers and make money more awesome.",Fintechs,74,82,ORG,
KeyCare is a virtual care platform powered by Epic created to support progressive health systems.,KeyCare,0,7,ORG,
KeyCare is a virtual care platform powered by Epic created to support progressive health systems.,Epic,46,50,ORG,
Metaverse Magna is a blockchain gaming platform that is maximizing value across the gaming ecosystem.,Metaverse Magna,0,15,PERSON,
"Wombat is a curated fractional thematic investment platform that allows people to invest in the brands they understand, use and love.",Wombat,0,6,ORG,
Senda Biosciences is a therapeutics platform company leveraging unprecedented insights into the molecular connections between humans.,Senda Biosciences,0,17,PERSON,
"Mermade an Israeli company that grows oysters from cells in a lab, says it can mitigate the sticky shock by using technology.",Israeli,11,18,NORP,
"Gunzilla Games is an independent, innovative, and player-focused developer of AAA games.",Gunzilla Games,0,14,ORG,
"Gunzilla Games is an independent, innovative, and player-focused developer of AAA games.",AAA,78,81,ORG,
Lightyear is a tech company that develops scalable grid-independent solar electric vehicles.,Lightyear,0,9,ORG,
Lumafield is an accessible X-ray CT platform that gives engineers better insights into product development and manufacturing.,Lumafield,0,9,GPE,
Mavenoid develops an AI-driven product support and troubleshooting platform for hardware companies.,Mavenoid,0,8,ORG,
"StayVista is a South Asia's largest luxury holiday home rental management company. We are on a mission to build the ""Marriott for Homes""",StayVista,0,9,ORG,
"StayVista is a South Asia's largest luxury holiday home rental management company. We are on a mission to build the ""Marriott for Homes""",South Asia's,15,27,LOC,
Zelluna Immunotherapy is a privately owned Norwegian biopharmaceutical company.,Zelluna Immunotherapy,0,21,PERSON,
Zelluna Immunotherapy is a privately owned Norwegian biopharmaceutical company.,Norwegian,43,52,NORP,
Insilico Medicine develops an AI platform for drug development to treat cancer and age-related diseases.,Insilico Medicine,0,17,ORG,
Insilico Medicine develops an AI platform for drug development to treat cancer and age-related diseases.,AI,30,32,GPE,
Neutral is a carbon-neutral food company that builds a sustainable carbon-neutral food ecosystem starting with milk and a half and half.,a half and half,120,135,DATE,
Flossy is a dental platform that offers patients access to high-quality dental care at an affordable price.,Flossy,0,6,ORG,
Zilla Security is an early-stage security startup that provides software-as-a-service security management platform.,Zilla Security,0,14,ORG,
Pattern Ag provides soil microbiome analysis and recommendations for input optimization on farms.,Pattern Ag,0,10,ORG,
"Anchor is a banking-as-a-service platform for African businesses to build, embed, and launch financial products.",Anchor,0,6,LOC,
"Anchor is a banking-as-a-service platform for African businesses to build, embed, and launch financial products.",African,46,53,NORP,
"Bridger Photonics is a LiDAR solutions provider, enabling new capabilities and improving efficiency for industrial sensor applications.",Bridger Photonics,0,17,PERSON,
Cultivated Biosciences is a Food Production Company.,a Food Production Company,26,51,ORG,
"Truework is a one-stop platform that helps banks, lenders, and others verify income and employment.",Truework,0,8,GPE,
"Truework is a one-stop platform that helps banks, lenders, and others verify income and employment.",one,14,17,CARDINAL,
