Text,Token,Start Index,End Index,Entity Label,Knowledge Base ID
"ArabyAds is an ad-tech company that offers a full range of services including online marketing, creative function, advertising and more.",ArabyAds,0,8,ORG,
AIRS Medical is an MRI reconstruction software service provider.,AIRS Medical,0,12,ORG,
Roleshare’s Enterprise Platform retains and attracts talent seeking flex through shared jobs.,Roleshare’s Enterprise Platform,0,31,ORG,
"Upfront Healthcare is a developer of patient navigation platform designed to combine analytics, dynamic content, and automated outreach.",Upfront Healthcare,0,18,ORG,
Solid is a one-stop shop that offers a fully integrated and compliant suite of fintech services.,one,11,14,CARDINAL,
Be Group is a transportation company that offers logistics delivery and transportation.,Be Group,0,8,ORG,
Explo operates a data exploration and analysis platform to connect directly to database or warehouse sources.,Explo,0,5,ORG,
Netspeak Games operates as a zero-crunch studio that develops online multiplayer games.,Netspeak Games,0,14,PERSON,
Netspeak Games operates as a zero-crunch studio that develops online multiplayer games.,zero,29,33,CARDINAL,
"Puna Bio develops biological inputs for agriculture that increase yields, reduce carbon emissions, and restore degraded soil.",Puna Bio,0,8,ORG,
Blue World Technologies is a fuel cell manufacturer especially in methanol fuel cells as an alternative to non-renewable fuels.,Blue World Technologies,0,23,ORG,
Octiv is a well-known platform for gym management software.,Octiv,0,5,PERSON,
HealthAssure is a healthtech startup that aggregates primary healthcare services and OPD insurance for corporates and individuals.,OPD,85,88,ORG,
Ryvu is a biopharmaceutical company developing small molecule therapies that address clinical limitations of current treatments in oncology.,Ryvu,0,4,PERSON,
Next-generation blockchain document management system (DMS),DMS,55,58,ORG,
Ready Player Me develops a cross-game avatar platform for the metaverse.,Ready Player Me,0,15,PERSON,
Kippa is a mobile app for African small company owners and bookkeepers that replaces physical record books.,African,26,33,NORP,
Invisible Universe is an internet-first animation studio that develops original character IP on social media and web3 platforms.,Universe,10,18,PERSON,
Invisible Universe is an internet-first animation studio that develops original character IP on social media and web3 platforms.,IP,90,92,ORG,
Safeheron is a platform that enables open and transparent self-custody of digital assets.,Safeheron,0,9,ORG,
Nanopath Inc. is a molecular diagnostics company enabling high-quality molecular testing in minutes.,Nanopath Inc.,0,13,ORG,
Nanopath Inc. is a molecular diagnostics company enabling high-quality molecular testing in minutes.,minutes,92,99,TIME,
CuriMeta is a real-world health data firm with a focus on life sciences.,CuriMeta,0,8,ORG,
BalkanID has developed the industry’s first AI-Powered Identity Governance and Administration (IGA) platform.,first,38,43,ORDINAL,
Agave Games is a mobile games publishing company and provides unique experiences,Agave Games,0,11,EVENT,
Sharwa is a social E-commerce Platform.,Sharwa,0,6,PERSON,
"3D Issue is a publishing platform for designing and deploying interactive digital editions, content centers, and branded apps.",3D Issue,0,8,ORG,
iProcure is a Kenyan startup focused on optimizing rural supply chains.,iProcure,0,8,ORG,
iProcure is a Kenyan startup focused on optimizing rural supply chains.,Kenyan,14,20,NORP,
Cygni Energy is a manufacturer of energy storage devices for commercial and institutional customers.,Cygni Energy,0,12,PERSON,
Modern Real Estate Investment Management,Modern Real Estate Investment Management,0,40,ORG,
Fair.xyz leverage the industry experience to build the best consumer products in Web3.,Web3,81,85,LOC,
VendorPM connects Property Managers with reputable Vendors.,Property Managers,18,35,ORG,
VendorPM connects Property Managers with reputable Vendors.,Vendors,51,58,ORG,
Sofy is a no-code test automation platform that enables end-to-end testing from the CI/CD pipeline on real devices.,CI,84,86,ORG,
Clip is the leading digital payments and commerce enablement platform in Mexico.,Mexico,73,79,GPE,
Liefergrün is a technology platform striving for the most convenient and sustainable delivery experience in e-commerce.,Liefergrün,0,10,ORG,
Learnsoft is a national leader in providing organizations with fully integrated learning solutions.,Learnsoft,0,9,ORG,
Ryft is the payment platform allowing marketplaces and digital platforms to scale within Web 3.0.,3.0,93,96,CARDINAL,
"Focal Point has developed next generation navigation and positioning software for smartphones, wearables and autonomous vehicles.",Focal Point,0,11,ORG,
"Access Capital Partners is a manager and advisor of private equity, private debt, and infrastructure funds and mandates.",Access Capital Partners,0,23,ORG,
"EeroQ is a quantum hardware start-up based in New York and Lansing, Michigan.",New York,46,54,GPE,
"EeroQ is a quantum hardware start-up based in New York and Lansing, Michigan.",Lansing,59,66,GPE,
"EeroQ is a quantum hardware start-up based in New York and Lansing, Michigan.",Michigan,68,76,GPE,
"Scalenut is an AI-powered content research and writing tool for original, high-ranking, long and short-form content.",AI,15,17,ORG,
Ultraviolette Automotive is a developer of electric two-wheeler vehicles offering clean energy and sustainable transportation to customers.,Ultraviolette Automotive,0,24,ORG,
Ultraviolette Automotive is a developer of electric two-wheeler vehicles offering clean energy and sustainable transportation to customers.,two,52,55,CARDINAL,
Bankme is a fintech that creates and operates mini banks for companies.,Bankme,0,6,ORG,
Usko Privacy provides a suite of analytics tools that enable consumers to monitor their spending.,Usko Privacy,0,12,ORG,
"Bitmama is a crypto-fiat exchange that allows traders to buy and sell Bitcoin, Ethereum, and other digital assets.","Bitcoin, Ethereum",70,87,ORG,
LANDE is a crowdfunding platform focused on financing the agricultural sector.,LANDE,0,5,ORG,
"Prellis employs holographic tissue printing technology with fully human antibody discovery, in vitro human disease and ADME/Tox models.",Prellis,0,7,PERSON,
"Prellis employs holographic tissue printing technology with fully human antibody discovery, in vitro human disease and ADME/Tox models.",ADME,119,123,ORG,
Fora is a travel agency that offers advisor-curated travel guides for destinations near and far.,Fora,0,4,PERSON,
DriveX digital platform helps in buying or renting pre-loved two-wheelers with quality checks and hassle-free documentation.,two,61,64,CARDINAL,
LiveEO is a real-time earth observation application that makes use of the synergies of EO data and geolocation services.,EO,87,89,ORG,
Waysia develops an application for ordering and delivering food.,Waysia,0,6,GPE,
Pomelo is a fintech startup combining credit and international money transfer in one unified product.,Pomelo,0,6,PERSON,
Pomelo is a fintech startup combining credit and international money transfer in one unified product.,one,81,84,CARDINAL,
Nreal is a developer of ready-to-wear mixed reality glasses.,Nreal,0,5,ORG,
FathomX is a Medical Imaging AI Spin-Off for breast cancer analysis from the National University of Singapore,a Medical Imaging AI Spin-Off,11,40,ORG,
FathomX is a Medical Imaging AI Spin-Off for breast cancer analysis from the National University of Singapore,the National University of Singapore,73,109,ORG,
Trial Library is an oncology clinical trials company.,Trial Library,0,13,PERSON,
Bravo Sierra is a military-native performance wellness company focused on personal care.,Bravo Sierra,0,12,PERSON,
Justhome operates as a home financing platform.,Justhome,0,8,ORG,
Adwoa Beauty is a beauty and hair care company located in Dallas.,Adwoa Beauty,0,12,PERSON,
Adwoa Beauty is a beauty and hair care company located in Dallas.,Dallas,58,64,GPE,
Forage is a payment processor that authenticates and processes EBT transactions.,EBT,63,66,ORG,
DataProphet is a developer of machine learning and AI technology to serve the manufacturing industry.,DataProphet,0,11,ORG,
DataProphet is a developer of machine learning and AI technology to serve the manufacturing industry.,AI,51,53,ORG,
Hillridge Technology helps farmers mitigate the financial impact of poor weather on their crops or livestock.,Hillridge Technology,0,20,ORG,
"Edutech, Education Technology",Edutech,0,7,ORG,
Advanced materials development and manufacture for Li-ion Battery electrodes,Battery,58,65,LOC,
"CreatorDAO is a decentralized community that invests in creators by providing capital, technology, and operational support.",CreatorDAO,0,10,PRODUCT,
KarmSolar is a private off-grid solar energy integrator in Egypt.,KarmSolar,0,9,ORG,
KarmSolar is a private off-grid solar energy integrator in Egypt.,Egypt,59,64,GPE,
BarrelWise Technologies provides technology to enhance wine production and analysis.,BarrelWise Technologies,0,23,ORG,
"IBus Network was founded in 2013, born of a vision to connect people, places and things by providing next generation in-building solutions",IBus Network,0,12,ORG,
"IBus Network was founded in 2013, born of a vision to connect people, places and things by providing next generation in-building solutions",2013,28,32,DATE,
Trojan Energy is a charge point operator supplying revolutionary 'flat and flush' on-street EV charging points.,Trojan Energy,0,13,PERSON,
Trojan Energy is a charge point operator supplying revolutionary 'flat and flush' on-street EV charging points.,EV,92,94,ORG,
"Triller is an AI-powered music video app that enables anyone to make professional videos, effortlessly.",Triller,0,7,GPE,
"Triller is an AI-powered music video app that enables anyone to make professional videos, effortlessly.",AI,14,16,ORG,
Naborforce connects older adults to a network of “Nabors” for social engagement and on-demand support for errands.,Naborforce,0,10,ORG,
Nimbus Therapeutics uses computational technology to create selective small molecule therapeutics.,Nimbus Therapeutics,0,19,PERSON,
Embedded lending for SMBs in Latin America,Latin America,29,42,LOC,
Omni is the only BI platform that combines the consistency of a shared data model with the freedom of SQL,Omni,0,4,ORG,
Omni is the only BI platform that combines the consistency of a shared data model with the freedom of SQL,BI,17,19,ORG,
Omni is the only BI platform that combines the consistency of a shared data model with the freedom of SQL,SQL,102,105,ORG,
A global network of metal suppliers and customers are connected through the full-stack digital supply-chain technology known as Metalbook.,Metalbook,128,137,ORG,
VidMob is a video content creation network and platform where brands can create digital video ads with expert teams.,VidMob,0,6,ORG,
"Gravitee is an API management platform that helps organizations to secure, build, monitor, and manage their API lifecyle.",API,15,18,ORG,
"Gravitee is an API management platform that helps organizations to secure, build, monitor, and manage their API lifecyle.",API,108,111,ORG,
Cygni Energy is a manufacturer of energy storage devices for commercial and institutional customers.,Cygni Energy,0,12,PERSON,
Neukio Biotherapeutics is a developer of allogenic immune cell therapies for treatment of cancer.,Neukio Biotherapeutics,0,22,PERSON,
TeraWatt Infrastructure operates an electric vehicle charging infrastructure for medium and heavy-duty transport and fleets.,TeraWatt Infrastructure,0,23,ORG,
"VRGL specializes in offering data analytics, portfolio performance, investment strategies, and guidance for wealth management businesses.",VRGL,0,4,ORG,
"Forge Biologics is a gene therapy development engine, enabling access to life changing gene therapy programs.",Forge Biologics,0,15,ORG,
Paper Boat is an e-commerce platform that sells beverages which are based on scientific observation and analysis of nature.,Paper Boat,0,10,PERSON,
MedMinder Systems provides products that focus on medication management and adherence.,MedMinder Systems,0,17,ORG,
"TCARE is an evidence-based, CMS-approved and federally-accredited family caregiver support platform.",TCARE,0,5,ORG,
"TCARE is an evidence-based, CMS-approved and federally-accredited family caregiver support platform.",CMS,28,31,ORG,
"SteelEye develops a holistic compliance platform for record keeping, surveillance, and intelligent insights.",SteelEye,0,8,ORG,
RiskSmart centralizes and digitalizes risk management for SME's.,RiskSmart,0,9,ORG,
RiskSmart centralizes and digitalizes risk management for SME's.,SME,58,61,ORG,
"PreciTaste, a proprietary Vision AI platform and leader in operational optimization, sets the standard for digital food AI management.",Vision AI,26,35,ORG,
"PreciTaste, a proprietary Vision AI platform and leader in operational optimization, sets the standard for digital food AI management.",AI,120,122,ORG,
"Clarity is transforming how governments, communities, and businesses understand and respond to air pollution with Sensing-as-a-Service.",Sensing,114,121,ORG,
"The 1st blockchain-based fully-automated platform to sell, underwrite, issue &amp; administer life insurance",1st,4,7,DATE,
Carroucell is the microcarrier supplier for cell culture in bioreactor.,Carroucell,0,10,ORG,
Vive Crop Protection is an agritech company that makes effective and sustainable pesticides for organic and non-organic production.,Vive Crop Protection,0,20,ORG,
Gotham Greens develops commercial-scale greenhouse facilities intended for sustainable vegetable production.,Gotham Greens,0,13,PERSON,
Oxbury Bank is an agricultural bank that provides farmers with specialized lending they need to run their farms.,Oxbury Bank,0,11,ORG,
Black Diamond Advisory is a global digital finance transformation firm and a Platinum Partner of OneStream Software.,Black Diamond Advisory,0,22,PERSON,
Black Diamond Advisory is a global digital finance transformation firm and a Platinum Partner of OneStream Software.,Platinum Partner of OneStream Software,77,115,ORG,
Virgin Voyages is a lifestyle travel brand offering cruise vacations across different destinations.,Virgin Voyages,0,14,PERSON,
ModernLoop is a platform to automates and streamlines interview coordination to ensure a great hiring experience,ModernLoop,0,10,ORG,
"Vidcare Innovations is a startup that develops portable health tests to make diagnostic testing convenient, accessible to everyone.",Vidcare Innovations,0,19,PERSON,
Clearbot creates autonomous and electric boats that augments different marine services.,Clearbot,0,8,PERSON,
LiveScore Group is a one of the real-time sports updates and streaming service providers.,LiveScore Group,0,15,ORG,
LiveScore Group is a one of the real-time sports updates and streaming service providers.,one,21,24,CARDINAL,
Papa Pawsome provides pet products for pets.,Papa Pawsome,0,12,PERSON,
Gallium Studios is a video game designer company that engages in develops video games and mobile games.,Gallium Studios,0,15,ORG,
Vive Crop Protection is an agritech company that makes effective and sustainable pesticides for organic and non-organic production.,Vive Crop Protection,0,20,ORG,
Landa is an app for real estate investing.,Landa,0,5,ORG,
Sei Labs is the layer 1 blockchain uniquely optimized for DeFi.,Sei Labs,0,8,PERSON,
Sei Labs is the layer 1 blockchain uniquely optimized for DeFi.,1,22,23,CARDINAL,
Sei Labs is the layer 1 blockchain uniquely optimized for DeFi.,DeFi,58,62,GPE,
"MetaverseGo is a web 3.0 app that offers easy access to play and earn games, guilds, NFTs, and decentralized applications.",3.0 app,21,28,QUANTITY,
Koop is a protocol that helps creators and communities launch NFT-based membership passes to raise funds for projects.,Koop,0,4,ORG,
Koop is a protocol that helps creators and communities launch NFT-based membership passes to raise funds for projects.,NFT,62,65,ORG,
"Willow Servicing is a fintech company that aids mortgage servicing through data accuracy, task automation, communications, and security.",Willow Servicing,0,16,PERSON,
VanDeMark Phosgene Chemistry and Custom Chemicals,VanDeMark Phosgene Chemistry,0,28,PERSON,
VanDeMark Phosgene Chemistry and Custom Chemicals,Custom Chemicals,33,49,ORG,
Lysto builds tools to standardise and showcase gamer credentials and reputation across games and platforms.,Lysto builds tools,0,18,PERSON,
ottonova is Germany's newest and purely digital health insurance,Germany,12,19,GPE,
Liwwa is a peer-to-peer lending network that connects investors and small businesses through smart business loans.,Liwwa,0,5,PERSON,
OasisFertiltiy is a comprehensive healthcare provider with specific attention to infertility treatments,OasisFertiltiy,0,14,ORG,
"Airtel is a global telecommunications company that provides mobile, voice, and data solutions.",Airtel,0,6,ORG,
XYXX Apparels is a retail and fashion company that offers clothing and accessories for men.,XYXX Apparels,0,13,PERSON,
"Injective is the blockchain built for finance. It is an open, interoperable network for applications shaping the future of DeFi.",DeFi,123,127,GPE,
Tailor is a Headless ERP that enables businesses to create their own customized ERP with no coding.,ERP,80,83,ORG,
Flyability is a Swiss company building safe drones for inaccessible places.,Swiss,16,21,NORP,
"Ardent Health Services is a premier provider of health care services,",Ardent Health Services,0,22,ORG,
Esensi Solusi Buana is the first restaurant technology in Indonesia with the most complete solution under ONE integrated platform.,Esensi Solusi,0,13,PERSON,
Esensi Solusi Buana is the first restaurant technology in Indonesia with the most complete solution under ONE integrated platform.,Buana,14,19,PERSON,
Esensi Solusi Buana is the first restaurant technology in Indonesia with the most complete solution under ONE integrated platform.,first,27,32,ORDINAL,
Esensi Solusi Buana is the first restaurant technology in Indonesia with the most complete solution under ONE integrated platform.,Indonesia,58,67,GPE,
Aptos is a web3 startup that builds a scalable Layer 1 blockchain.,Layer 1,47,54,ORG,
Arevia Power operates as a utility-scale solar and wind developer.,Arevia Power,0,12,ORG,
"Providing college women+ with integrated mental, reproductive and physical healthcare",healthcare,75,85,ORG,
Comm Technologies is scaling E2E encryption with personal private servers.,Comm Technologies,0,17,ORG,
"Figures provides real time compensation intelligence to companies, with the most extensive benchmark for European venture-backed companies.",European,105,113,NORP,
Liwwa is a peer-to-peer lending network that connects investors and small businesses through smart business loans.,Liwwa,0,5,PERSON,
Cour Pharmaceuticals Development is developing nanoparticle technology to help reset the immune system of multiple sclerosis (MS) patients.,Cour Pharmaceuticals Development,0,32,ORG,
"Wega Labs is a 'utility and gameplay' first web3 gaming studio, building fun strategy games with play and earn mechanics",Wega Labs,0,9,PERSON,
"AESOP makes physician clinical documentation easier, faster and less error prone using Machine Learning on 3.2 billion patient visits.",Machine Learning,87,103,WORK_OF_ART,
"AESOP makes physician clinical documentation easier, faster and less error prone using Machine Learning on 3.2 billion patient visits.",3.2 billion,107,118,CARDINAL,
OQ Technology provides ubiquitous global network coverage for the next unconnected 50 billion IoT devices and machines,50 billion IoT,83,97,MONEY,
GrayMatter Robotics creates solutions to assist humans in tedious and ergonomically challenging tasks.,GrayMatter Robotics,0,19,PRODUCT,
Mahaana is Pakistan’s first digital wealth manager.,Mahaana,0,7,ORG,
Mahaana is Pakistan’s first digital wealth manager.,Pakistan,11,19,GPE,
Mahaana is Pakistan’s first digital wealth manager.,first,22,27,ORDINAL,
India's First SaaS-Led B2B Retail commerce platform,India,0,5,GPE,
India's First SaaS-Led B2B Retail commerce platform,First,8,13,ORDINAL,
Smart &amp; Social Web3 Platform,Smart &amp,0,10,ORG,
Smart &amp; Social Web3 Platform,Social Web3 Platform,12,32,ORG,
Sigma Ratings is an AI-powered non-credit rating agency focused on quantifying company-level non-credit risks.,AI,20,22,ORG,
"Starboard is an IT company that provides accounting, compliance, tax, and business advisory services.",Starboard,0,9,ORG,
oVice is a virtual space based on voice chat that helps teams stay connected.,oVice,0,5,ORG,
"vLex offers the professional, governmental, and academic markets with legal contents and solutions.",vLex,0,4,ORG,
Carret is a one-stop crypto investment platform for everyone.,Carret,0,6,ORG,
Carret is a one-stop crypto investment platform for everyone.,one,12,15,CARDINAL,
Jet Commerce is a e-commerce digital marketing company located in Jakarta.,Jakarta,66,73,GPE,
Kuria Therapeutics operates as a pharmaceutical company.,Kuria Therapeutics,0,18,PERSON,
"Penrhos Bio is creating novel, organically inspired substances to reduce microbial biofilms.",Penrhos Bio,0,11,ORG,
Flyway uses PropTech to make second home ownership affordable and hassle-free in the heart of European capitals.,PropTech,12,20,ORG,
Flyway uses PropTech to make second home ownership affordable and hassle-free in the heart of European capitals.,second,29,35,ORDINAL,
Flyway uses PropTech to make second home ownership affordable and hassle-free in the heart of European capitals.,European,94,102,NORP,
Sustainable Medical Protection,Sustainable Medical Protection,0,30,ORG,
iQure Pharma is a global biotech company that develops new therapeutics for patients and physicians.,Pharma,6,12,PERSON,
DeepWay is a maker and developer of intelligent electric commercial vehicles.,DeepWay,0,7,ORG,
Super Payments is a fintech that disrupts the industry behemoths Visa and MasterCard.,Visa,65,69,ORG,
Super Payments is a fintech that disrupts the industry behemoths Visa and MasterCard.,MasterCard,74,84,ORG,
Modern Democracy is an election software systems and consulting services provider.,Modern Democracy,0,16,ORG,
TRIP is a CBD brand that sells wellness products infused with adaptogens.,TRIP,0,4,PERSON,
Rusk Media is a content studio that distributes their own premium IPs and branded content across social media platforms.,Rusk Media,0,10,PERSON,
Aqua-Yield™ is a rapid-growing sustainable fertilizer technology company. Aqua-Yield is the leader in nanotechnology for Agribusiness.,Aqua-Yield,74,84,ORG,
MiAlgae is a new-age microalgal production company .,MiAlgae,0,7,ORG,
Exagen Group is passionate about renewable energy and its role in driving down greenhouse gas emissions.,Exagen Group,0,12,ORG,
XYXX Apparels is a retail and fashion company that offers clothing and accessories for men.,XYXX Apparels,0,13,PERSON,
Oasys is a Blockchain designed exclusively for the gaming industry.,Oasys,0,5,ORG,
Oasys is a Blockchain designed exclusively for the gaming industry.,Blockchain,11,21,LOC,
"Develop, manufacture and commercialize mycorrhizal inoculants for mainstream agriculture",Develop,0,7,ORG,
"Patch focuses on building infrastructure for a climate-positive economy, starting with an API for carbon removal.",API,90,93,ORG,
Ampeers Energy develops energy management software for companies in the real estate industry to reduce their carbon footprint.,Ampeers Energy,0,14,ORG,
Chamberlain Coffee is a manufacturer and retailer of coffee and related products.,Chamberlain Coffee,0,18,PERSON,
Sync Computing is a cloud infrastructure company that develops of an optimization processing unit.,Sync Computing,0,14,ORG,
ThreatX is a web application and API Protection Solution that enables enterprises to secure all their applications.,API Protection Solution,33,56,ORG,
Joonko offers a recruiting software that provides managers and employees with real-time insights and recommendations.,Joonko,0,6,PERSON,
Mobot is a QA-as-a-service platform using real mechanical robots to automate testing on real mobile devices.,Mobot,0,5,PERSON,
Mobot is a QA-as-a-service platform using real mechanical robots to automate testing on real mobile devices.,QA,11,13,GPE,
SaNOtize is a biotech company using a platform technology for topical to treat upper respiratory and dermal infections.,SaNOtize,0,8,ORG,
Klar is an aesthetic dental technology startup that provides cosmetic dentistry treatments.,Klar,0,4,ORG,
Josys is the Japanese B2B SaaS platform that streamlines and automates corporate IT operations.,Josys,0,5,ORG,
Josys is the Japanese B2B SaaS platform that streamlines and automates corporate IT operations.,Japanese,13,21,NORP,
"SageWealth focuses on sustainability, including growth-focused equity-based and safety-focused bond and commodity-based options.",SageWealth,0,10,ORG,
CareHarmony is the premier provider of technology-enabled care coordination services for chronic disease management.,CareHarmony,0,11,ORG,
Remedium Bio is a gene therapy company focused on the development of highly innovative treatments for a broad range of diseases.,Remedium Bio,0,12,PERSON,
Bacon helps companies find qualified workers to fill shifts on short notice using an app.,Bacon,0,5,ORG,
"FromSoftware is a video game development company focusing on games for PlayStation, Xbox, Nintendo, Windows, and Wii platforms.",FromSoftware,0,12,ORG,
"FromSoftware is a video game development company focusing on games for PlayStation, Xbox, Nintendo, Windows, and Wii platforms.",PlayStation,71,82,PRODUCT,
"FromSoftware is a video game development company focusing on games for PlayStation, Xbox, Nintendo, Windows, and Wii platforms.",Xbox,84,88,ORG,
"FromSoftware is a video game development company focusing on games for PlayStation, Xbox, Nintendo, Windows, and Wii platforms.",Nintendo,90,98,ORG,
