Text,Token,Start Index,End Index,Entity Label,Knowledge Base ID
"Lytica is a supply chain analytics SaaS provider to electronics companies focusing on supply chain cost, security of supply and compliance.",Lytica,0,6,PERSON,
Slide enables dApps to serve effortless web3 experiences to everyday users.,dApps,14,19,ORG,
Monod Bio is a life sciences company developing biosensors for protein and other analyte detection.,Monod Bio,0,9,PERSON,
Kterio is the leading provider of data-driven services for real estate portfolio owners.,Kterio,0,6,PERSON,
Jodo is a mission-oriented fintech company which is building customized financial products for middle-income households in urban India.,India,129,134,GPE,
Brand Advocacy Platform that enables purpose-led brands to drive organic growth &amp; retention through word-of-mouth &amp; advocacy,Advocacy Platform,6,23,PERSON,
Brand Advocacy Platform that enables purpose-led brands to drive organic growth &amp; retention through word-of-mouth &amp; advocacy,organic growth &amp,65,84,ORG,
Agritech IoT SAAS company helping farmers take better decisions based on live data from the field,Agritech IoT,0,12,ORG,
Agritech IoT SAAS company helping farmers take better decisions based on live data from the field,SAAS,13,17,ORG,
RecruitLab is a recruiter-centric marketing and applicant tracking software.,RecruitLab,0,10,ORG,
Fire &amp; Flower is an adult-use cannabis retailer that guides consumers through education-focused retailing.,Fire &amp,0,9,ORG,
Fire &amp; Flower is an adult-use cannabis retailer that guides consumers through education-focused retailing.,Flower,11,17,GPE,
Moneyflow provides flexibility to payment services.,Moneyflow,0,9,ORG,
BioBetter is a foodtech company that develops plant-based platforms for the production of complex growth factors used in cultivated meat.,BioBetter,0,9,ORG,
Terabase Energy is a web-based tool that reduces cost and deployment timelines by digitalizing the solar power plant.,Terabase Energy,0,15,ORG,
"Daalchini provides affordable, quality home-food instantly via smart vending machines.",Daalchini,0,9,ORG,
"Vestaron produces insecticides for agriculture, animal health, non-crop, and commercial pest control applications.",Vestaron,0,8,ORG,
WiTricity Corporation provides technology to enable wireless power transfer over distance using magnetic resonance.,WiTricity Corporation,0,21,ORG,
Yulu is a micro-mobility platform powered by shared electric two-wheelers aiming to reduce traffic congestion and air pollution in India.,two,61,64,CARDINAL,
Yulu is a micro-mobility platform powered by shared electric two-wheelers aiming to reduce traffic congestion and air pollution in India.,India,131,136,GPE,
"Rupeek is an online lending platform that specializes in credit risk, gold loans, and personal loans.",Rupeek,0,6,PERSON,
Ultrade offers comprehensive DeFi suite of applications and DeFi as a Service technology on Algorand Layer-1.,Ultrade,0,7,ORG,
Ultrade offers comprehensive DeFi suite of applications and DeFi as a Service technology on Algorand Layer-1.,Service,70,77,ORG,
Ultrade offers comprehensive DeFi suite of applications and DeFi as a Service technology on Algorand Layer-1.,Algorand,92,100,ORG,
Manus Bio makes nature accessible and affordable for a growing society.,Manus Bio,0,9,PERSON,
Edamama is a Philippine based e-commerce platform designed for mothers.,Philippine,13,23,NORP,
Wreno provides high-paying home service jobs and required training across.,Wreno,0,5,GPE,
SessionGuardian is the market pioneer in identity access control and authentication for hybrid teams working with extremely sensitive data.,SessionGuardian,0,15,ORG,
Afresh is an AI-powered company selling software to track demand and manage orders for fresh produce in grocery stores.,AI,13,15,ORG,
Spearix Technologies is an early stage startup realizing hardware and software technology.,Spearix Technologies,0,20,ORG,
CompScience makes your workplace safer and lowers your rates with the only AI-powered workers' comp policy on the market.,CompScience,0,11,ORG,
CompScience makes your workplace safer and lowers your rates with the only AI-powered workers' comp policy on the market.,AI,75,77,ORG,
"BlueTape is a payment and financing platform for the construction industry, offering a “Buy Now, Pay Later” solution for building materials.",BlueTape,0,8,ORG,
promiseQ offers the exceptional confluence of cutting-edge AI &amp; certified crowd workers.,AI &,59,63,ORG,
Boopos operates a tech-enabled lending platform for acquiring small businesses.,Boopos,0,6,PERSON,
"Versa, a digital cash management platform, is here to turn dormant cash into money-earning potential through return rates.",Versa,0,5,ORG,
Sunwoda Electric Vehicle Batter provides electric vehicle battery pack solutions for new energy vehicle companies.,Sunwoda Electric Vehicle Batter,0,31,ORG,
"Everdome will provide a destination for Metahero's remarkable technology to live, interact, and flourish.",Metahero,40,48,ORG,
Bike Bazaar is a finance company that specializes in financing pre-owned and new Two-Wheelers.,Bazaar,5,11,PERSON,
Bike Bazaar is a finance company that specializes in financing pre-owned and new Two-Wheelers.,Two,81,84,CARDINAL,
Outpost is the sustainable space company. We enable precision Earth Return of satellites and orbital payload missions.,Earth Return,62,74,NORP,
Bounty helps real customers get paid for sharing products they love on TikTok.,TikTok,71,77,ORG,
Biotia is a health tech startup offering AI-based solutions to diagnose and control infectious disease.,Biotia,0,6,PERSON,
Biotia is a health tech startup offering AI-based solutions to diagnose and control infectious disease.,AI,41,43,ORG,
SunRoof is a start-up developing fully solar 2-in-1 roofs and façades as well as solutions to support smart energy management.,SunRoof,0,7,ORG,
SunRoof is a start-up developing fully solar 2-in-1 roofs and façades as well as solutions to support smart energy management.,2,45,46,CARDINAL,
Keen Technologies is a online Software Training | IT Training.,Keen Technologies,0,17,ORG,
Keen Technologies is a online Software Training | IT Training.,Software Training,30,47,ORG,
Autobahn Therapeutics is a developer of regenerative medicines to restore hope for people affected by CNS disorders.,Autobahn Therapeutics,0,21,PERSON,
Autobahn Therapeutics is a developer of regenerative medicines to restore hope for people affected by CNS disorders.,CNS,102,105,ORG,
"Electrifuel is an EV Technology startup that provides BMS, EV Telematics, Cloud management and Bespoke Integrations services.",EV Technology,18,31,ORG,
"Electrifuel is an EV Technology startup that provides BMS, EV Telematics, Cloud management and Bespoke Integrations services.",BMS,54,57,ORG,
"Electrifuel is an EV Technology startup that provides BMS, EV Telematics, Cloud management and Bespoke Integrations services.",EV Telematics,59,72,ORG,
"Electrifuel is an EV Technology startup that provides BMS, EV Telematics, Cloud management and Bespoke Integrations services.",Cloud,74,79,NORP,
"Electrifuel is an EV Technology startup that provides BMS, EV Telematics, Cloud management and Bespoke Integrations services.",Bespoke Integrations,95,115,ORG,
GrowthSpace is a talent development platform that enables the personalized learning and development of employees.,GrowthSpace,0,11,ORG,
BillEase offers applications that split customer payments into installments at more than 500 merchant partners.,BillEase,0,8,ORG,
BillEase offers applications that split customer payments into installments at more than 500 merchant partners.,more than 500,79,92,CARDINAL,
"MyMuse India creates high quality, well-designed products for your sacred spaces, and content that’s informative and real.",MyMuse India,0,12,ORG,
EnviroSpark specializes in the design and installation of electric vehicle charging station solutions.,EnviroSpark,0,11,ORG,
"Clara is the leading B2B LatAm business credit card, payment solution, and expense tracking platform.",Clara,0,5,PERSON,
OMRT is a parametric design+engineering enterprise.,OMRT,0,4,ORG,
CorePower Magnetics’ patented combination of advanced manufacturing processes and novel materials to increase electric vehicle ranges.,CorePower Magnetics,0,19,ORG,
An Airgram is a real-time transcription with speaker identification and high-definition video recording.,Airgram,3,10,ORG,
Enliven is the original virtual reality business committed to doing good.,Enliven,0,7,PERSON,
Diri Care provides Personalized healthcare solutions.,Diri Care,0,9,ORG,
Diri Care provides Personalized healthcare solutions.,Personalized,19,31,PERSON,
ZippMat is a SCaaS enterprise that provides a one-stop solution for all supply chain management needs of construction companies.,ZippMat,0,7,ORG,
ZippMat is a SCaaS enterprise that provides a one-stop solution for all supply chain management needs of construction companies.,one,46,49,CARDINAL,
Aditya Birla Health Insurance provides health insurance services.,Aditya Birla Health Insurance,0,29,ORG,
"ATLAS Space Operations is the Satellite Communications as a Service Getting Your Data, Faster",ATLAS Space Operations,0,22,ORG,
"ATLAS Space Operations is the Satellite Communications as a Service Getting Your Data, Faster",the Satellite Communications,26,54,ORG,
"ATLAS Space Operations is the Satellite Communications as a Service Getting Your Data, Faster",Faster,87,93,PERSON,
Closinglock is modernizing the real estate world’s way of transferring information to eliminate wire fraud &amp; protect buyers.,Closinglock,0,11,ORG,
IDnow is a technology startup that provides advanced machine-learning technology for its Identity Verification-as-a-Service platform.,Identity Verification-as-a-Service,89,123,ORG,
"Create, collaborate on, and explain compensation practices from day zero.",from day zero,59,72,DATE,
Techmer PM is a plastics company that manufactures colors and additives.,PM,8,10,TIME,
"Ayekart Fintech is a supply chain and finance startup that offers a digital marketplace for manufacturers, processors, and distributors.",Ayekart Fintech,0,15,PERSON,
Reejig is a workforce intelligence platform powered by the world's first independently audited Ethical Talent AI.,first,67,72,ORDINAL,
ImIn is an employee scheduling app that organizations grows while saving time and money &amp; empowering teams to work when and how they want.,ImIn,0,4,ORG,
OBM Education offers career development navigation tools for high school and university students.,OBM Education,0,13,ORG,
Industrial Phycology has designed and patented a system to harness the power of algae to remove nutrients.,Industrial Phycology,0,20,ORG,
"BlueTape is a payment and financing platform for the construction industry, offering a “Buy Now, Pay Later” solution for building materials.",BlueTape,0,8,ORG,
Populus is a data platform for cities to manage and price commercial fleets.,Populus,0,7,ORG,
Bored Beverages caters to the Indian palate with a variety of interesting beverages.,Bored Beverages,0,15,ORG,
Bored Beverages caters to the Indian palate with a variety of interesting beverages.,Indian,30,36,NORP,
Cannabis Management Platform,Cannabis Management Platform,0,28,ORG,
Koibanx is a software company focused on Smart Contracts Solutions &amp; Blockchain Services,Smart Contracts Solutions &,41,68,ORG,
Koibanx is a software company focused on Smart Contracts Solutions &amp; Blockchain Services,Blockchain Services,73,92,ORG,
NFT Genius creates the next generation of immersive NFT experiences.,NFT Genius,0,10,ORG,
NFT Genius creates the next generation of immersive NFT experiences.,NFT,52,55,ORG,
SureBright is an insurance-as-a-Service platform that enables any company to embed insurance and warranty products on their website.,SureBright,0,10,ORG,
"Aisera provides AI-driven service solution that automates operations and support for IT, human resources, sales, and customer service.",Aisera,0,6,ORG,
"Aisera provides AI-driven service solution that automates operations and support for IT, human resources, sales, and customer service.",AI,16,18,ORG,
Bigspoon is a cloud kitchen startup that has an omnichannel approach to ordering and delivery.,Bigspoon,0,8,GPE,
Impactsure Technologies is a technology consulting organization providing strategic consulting &amp; technology Services.,Impactsure Technologies,0,23,ORG,
"Cultures To Love is the leading provider of Kefir, Yogurt, Kombucha, Sourdough &amp; Tempeh products in India.",Kefir,44,49,GPE,
"Cultures To Love is the leading provider of Kefir, Yogurt, Kombucha, Sourdough &amp; Tempeh products in India.",Yogurt,51,57,GPE,
"Cultures To Love is the leading provider of Kefir, Yogurt, Kombucha, Sourdough &amp; Tempeh products in India.","Kombucha, Sourdough &",59,80,ORG,
"Cultures To Love is the leading provider of Kefir, Yogurt, Kombucha, Sourdough &amp; Tempeh products in India.",Tempeh,85,91,ORG,
"Cultures To Love is the leading provider of Kefir, Yogurt, Kombucha, Sourdough &amp; Tempeh products in India.",India,104,109,GPE,
"Addigy provides a cloud based IT Management Platform specifically for managing your Apple ecosystem, including all Macs and iOS devices.",Addigy,0,6,PERSON,
"Addigy provides a cloud based IT Management Platform specifically for managing your Apple ecosystem, including all Macs and iOS devices.",Apple,84,89,ORG,
"Addigy provides a cloud based IT Management Platform specifically for managing your Apple ecosystem, including all Macs and iOS devices.",Macs,115,119,ORG,
"Churned is a Data-driven customer success for SaaS, B2C &amp; E-commerce.",B2C &amp,52,60,ORG,
Code First Girls works to increase the number of women in tech and entrepreneurship,First,5,10,ORDINAL,
Modernizing Speciality Insurance,Modernizing Speciality Insurance,0,32,ORG,
ClaimLogiq is an information technology company that offers healthcare payment software development and sales services.,ClaimLogiq,0,10,ORG,
Stratifyd is an AI powered analytics platform that enable enterprise companies to transform structured and unstructured human textual data.,AI,16,18,GPE,
Onego Bio is a smart protein is a piece of cake.,Onego Bio,0,9,PERSON,
ReNew Power is a renewable energy company that focuses on wind-energy projects.,ReNew Power,0,11,ORG,
Atropos Health rapidly provides personalized real-world evidence for any clinical decision.,Atropos Health,0,14,ORG,
Blockchain Development Company,Blockchain Development Company,0,30,ORG,
101 Inc provides food processing solutions.,101,0,3,CARDINAL,
101 Inc provides food processing solutions.,Inc,4,7,ORG,
Lumifi Cyber is a next-generation managed detection and response (MDR) cybersecurity software provider.,Lumifi Cyber,0,12,ORG,
Lumifi Cyber is a next-generation managed detection and response (MDR) cybersecurity software provider.,MDR,66,69,ORG,
Pastel supports African businesses by offering tools that help manage their businesses and maximize efficiency.,Pastel,0,6,ORG,
Pastel supports African businesses by offering tools that help manage their businesses and maximize efficiency.,African,16,23,NORP,
MedinCell is an injectable slow-release drug specialist company.,MedinCell,0,9,ORG,
Bloom Biorenewables is making biomass a true alternative to petroleum.,Bloom Biorenewables,0,19,ORG,
Unstoppable Domains launches domains secured by blockchains and builds uncensorable websites.,Domains,12,19,PERSON,
"Geek+ develops autonomous mobile robots for warehouse, factory, and supply chain management.",Geek+,0,5,GPE,
InMed Pharmaceuticals is a clinical-stage company developing cannabinoid-based pharmaceutical drug candidates.,InMed Pharmaceuticals,0,21,ORG,
Escalate Capital Partners is a mezzanine firm focused on investments in late-stage technology companies.,Escalate Capital Partners,0,25,ORG,
Healthledger Diagnostics focuses on intensive use of technology to automate the wellness diagnostics Industry.,Healthledger Diagnostics,0,24,PERSON,
"Phenna Group is a specialist businesses focused on the testing, inspection, certification, and compliance (TICC) Sector.",Phenna Group,0,12,ORG,
MatchboxDAO is hosting its first virtual Hackathon for building tools on Starknet.,first,27,32,ORDINAL,
MatchboxDAO is hosting its first virtual Hackathon for building tools on Starknet.,Starknet,73,81,ORG,
Expedock is an AI-based outsourcing services provider for logistics and freight providers.,AI,15,17,ORG,
ApniBus operates as an intercity bus platform.,ApniBus,0,7,ORG,
"Low Carbon is investing in, owning and operating renewable energy projects, Low Carbon is confronting climate change.",Low Carbon,76,86,ORG,
"TMC Pharma is a pharmaceutical development organization that offers clinical, nonclinical, medical support, and pharmacovigilance services.",TMC Pharma,0,10,PERSON,
"TMC Pharma is a pharmaceutical development organization that offers clinical, nonclinical, medical support, and pharmacovigilance services.",nonclinical,78,89,ORG,
ConverseNow develops a personalized and natural two-way conversation platform for the restaurant ordering experience.,ConverseNow,0,11,ORG,
ConverseNow develops a personalized and natural two-way conversation platform for the restaurant ordering experience.,two,48,51,CARDINAL,
Mycel Project develops and manufactures a wide range of biomaterials that can be used to substitute leather and flesh.,Mycel Project,0,13,ORG,
Jackett is an educational app that helps students in the learning process.,Jackett,0,7,PERSON,
InSightec develops and manufactures MR-guided ultrasound technology devices for image-guided acoustic surgery.,MR,36,38,GPE,
Cartona is a B2B e-commerce marketplace that connects buyers and sellers across the supply chain.,Cartona,0,7,ORG,
"CathVision helps guide ablation therapy of cardiac arrhythmia with novel hardware, software and data science.",CathVision,0,10,ORG,
Sibel Health develops a neonatal epidermal system designed for wireless vital signs monitoring.,Sibel Health,0,12,ORG,
"Doodles is a web3 NFT, media, and entertainment brand.",NFT,18,21,ORG,
Nitra brings all-in-one finance to the traditional industries of America.,one,20,23,CARDINAL,
Nitra brings all-in-one finance to the traditional industries of America.,America,65,72,GPE,
Wealthfront is a next-gen banking service that helps manage money for both short-term and long-term wealth.,Wealthfront,0,11,GPE,
UDO Games operates as a mobile gaming startup.,UDO Games,0,9,ORG,
Pomelo is a fintech startup combining credit and international money transfer in one unified product.,Pomelo,0,6,PERSON,
Pomelo is a fintech startup combining credit and international money transfer in one unified product.,one,81,84,CARDINAL,
Neurolens designs prescription lenses that add a contoured prism to bring the eyes into alignment.,Neurolens,0,9,GPE,
Peer Robotics is an industrial automation company that provides an easier and cost efficient way to integrate and deploy mobile robots.,Peer Robotics,0,13,ORG,
"Psych Hub is a website that offers short movies and Learning Hubs about mental health, substance abuse, and crime prevention.",Learning Hubs,52,65,PERSON,
ProntoPro is a marketplace that connects people in need with artisans and professional workers and small businesses.,ProntoPro,0,9,ORG,
UpGrad is an online higher education platform providing various programs.,UpGrad,0,6,ORG,
Sender Wallet is a NEAR ecological encrypted wallet.,Sender Wallet,0,13,PERSON,
Sender Wallet is a NEAR ecological encrypted wallet.,NEAR,19,23,ORG,
"Venue helps culture-obsessed companies turn their recurring rituals - like All Hands, Town Halls, Exec AMAs, and more",All Hands,75,84,ORG,
B+J Studios is the 0 to 1 builder studio developing world-class blockchain-based solutions.,B+J Studios,0,11,ORG,
B+J Studios is the 0 to 1 builder studio developing world-class blockchain-based solutions.,1,24,25,CARDINAL,
Byte Kitchen builds ghost kitchens that make the best dishes from the best restaurants.,Byte Kitchen,0,12,PERSON,
RipeLocker is an agtech company that develops containers designed to extend the life of perishables.,RipeLocker,0,10,ORG,
Bachan's is a food and beverage company that produces traditional Japanese barbecue sauce to serve customers.,Bachan,0,6,ORG,
Bachan's is a food and beverage company that produces traditional Japanese barbecue sauce to serve customers.,Japanese,66,74,NORP,
"Renkube is a business with a focus on renewable energy, and its innovators are in the field of solar panel Motion Free Optical Tracking.",Motion Free Optical Tracking,107,135,ORG,
Betr is a direct-to-consumer micro-betting that introduces instant gratification to sports betting.,Betr,0,4,ORG,
Twid (That’s What I Do) is India’s first rewards-based payment network.,India,27,32,GPE,
Twid (That’s What I Do) is India’s first rewards-based payment network.,first,35,40,ORDINAL,
"Jiminny allows users to record, transcribe, and analyze calls and meetings in real-time to help capture important data points.",Jiminny,0,7,ORG,
Dwija Foods is a B2B beverage vending company.,Dwija Foods,0,11,ORG,
Myplanet is an online software developer that provides customized product production and retail platform engineering.,Myplanet,0,8,PRODUCT,
"INK Games is a technology startups that creates virtual playground for gamers, social influencers, and online users.",INK Games,0,9,ORG,
Landa is an app for real estate investing.,Landa,0,5,ORG,
Majoo is a business Software-as-a-Service provider for small and medium-sized enterprises solutions.,Software,20,28,ORG,
boomerank is a SaaS that helps eCommerce companies grow automatically with help of a powerful AI and the creation of an immense data hub.,boomerank,0,9,ORG,
boomerank is a SaaS that helps eCommerce companies grow automatically with help of a powerful AI and the creation of an immense data hub.,AI,94,96,ORG,
NMB Bank is a commercial bank in Nepal that provides banking and financial services.,NMB Bank,0,8,ORG,
NMB Bank is a commercial bank in Nepal that provides banking and financial services.,Nepal,33,38,GPE,
iFood is an online food ordering and delivery platform that offers a list of restaurants.,iFood,0,5,ORG,
Stacked is developing a web3-based version of Twitch for video game streaming.,Twitch,46,52,NORP,
Pinata is a media management company that provides media infrastructure and NFT platforms for creators and developers.,Pinata,0,6,ORG,
Pinata is a media management company that provides media infrastructure and NFT platforms for creators and developers.,NFT,76,79,ORG,
ProfilePrint provides a food ingredient analysis platform.,ProfilePrint,0,12,ORG,
Savana is a software company that provides a digital banking platform.,Savana,0,6,GPE,
Vestaboard develops an internet-connected display intended to help design and provide information through wall-hanging screens.,Vestaboard,0,10,ORG,
MyDr NOW is a Health Care Company On demand.,a Health Care Company On,12,36,ORG,
Ambassador Labs is making it easy for developers to build resilient microservices.,Labs,11,15,PERSON,
28 by Evie is a women’s fitness company that currently operates in stealth mode.,28,0,2,CARDINAL,
AI/ML Boutique Fitness Automation Software Platform / Vertical SaaS serving $2B Boutique Fitness &amp; Personal Training Market,AI/ML Boutique Fitness Automation Software Platform / Vertical,0,62,ORG,
AI/ML Boutique Fitness Automation Software Platform / Vertical SaaS serving $2B Boutique Fitness &amp; Personal Training Market,$2B Boutique Fitness &,76,98,MONEY,
AI/ML Boutique Fitness Automation Software Platform / Vertical SaaS serving $2B Boutique Fitness &amp; Personal Training Market,Personal Training Market,103,127,ORG,
Lazada Group operates an online shopping and selling destination in Southeast Asia.,Lazada Group,0,12,ORG,
Lazada Group operates an online shopping and selling destination in Southeast Asia.,Southeast Asia,68,82,LOC,
Reliance Partners operates as a trucking and commercial insurance agency.,Reliance Partners,0,17,ORG,
Junto is an EdTech that offers digital live training for companies.,EdTech,12,18,ORG,
Ribbon Communications is a company with two decades of leadership in real-time communications.,Ribbon Communications,0,21,ORG,
Ribbon Communications is a company with two decades of leadership in real-time communications.,two decades,40,51,DATE,
Meson offers minute-fast swaps across all major blockchains with virtually no fees and slippage.,Meson,0,5,GPE,
"Homeward is focused on improving access to high-quality, affordable primary and specialty care in rural communities.",Homeward,0,8,PERSON,
iQure Pharma is a global biotech company that develops new therapeutics for patients and physicians.,Pharma,6,12,PERSON,
India's largest Digital Distribution Network,India,0,5,GPE,
India's largest Digital Distribution Network,Digital Distribution Network,16,44,ORG,
Apeiron Bioenergy is an integrated global player in the entire chain of bioenergy products from feedstock to the end and by-products.,Apeiron Bioenergy,0,17,PERSON,
The Cape Town Stock Exchange is a south Africa’s stock exchange for small- and medium-sized businesses.,The Cape Town Stock Exchange,0,28,ORG,
The Cape Town Stock Exchange is a south Africa’s stock exchange for small- and medium-sized businesses.,Africa,40,46,LOC,
"Provention Bio is a clinical stage biopharmaceutical dedicated to sourcing, developing and commercializing novel therapeutics.",Provention Bio,0,14,ORG,
"Medication Delivery, Third-Party Administration services, Data Management, Risk-Management",Third-Party Administration,21,47,ORG,
"Medication Delivery, Third-Party Administration services, Data Management, Risk-Management",Data Management,58,73,ORG,
The 1937 Group is the first vertically integrated cannabis company that is owned by a minority.,1937,4,8,DATE,
The 1937 Group is the first vertically integrated cannabis company that is owned by a minority.,first,22,27,ORDINAL,
Sunday Design offers modern products made in India but designed in Italy.,Sunday Design,0,13,ORG,
Sunday Design offers modern products made in India but designed in Italy.,India,45,50,GPE,
