Text,Noun,Number of Nouns,Verb,Number of Verbs,Adjective,Number of Adjectives
"Bec Chapin, Jessica Livingston, Lucas Thomaz, Nizar Batada, Paul Graham, Raffaele Colella, Robert Morris, Trevor Blackwell",[],0,[],0,[],0
Carlos Moedas,[],0,[],0,[],0
"Kim Alter, Vannevar Bush",[],0,[],0,[],0
"Bec Chapin, Brad Feld, Dan Driscoll, David Brown, David Cohen, David Tisch, Jared Polis, Sam Yagan",[],0,[],0,[],0
"Akhil Nigam, Cait Brumme, David Constantine, John Harthorne",[],0,[],0,[],0
"Brian Curliss, Christine Tsai, Dave McClure",[],0,[],0,[],0
Sean O'Sullivan,[],0,[],0,[],0
"Chuck Newhall, Frank A. Bonsal, Richard Kramlich",[],0,[],0,[],0
"Arthur Patterson, Jim Swartz, Prashanth Prakash, Subrata Mitra",[],0,[],0,[],0
"Aadit Palicha, Bill Coughran, Don Valentine",[],0,[],0,[],0
"Joao Kepler Braga, Pierre Schurmann",[],0,[],0,[],0
"Les Vadasz, Peter Levin",[],0,[],0,[],0
"Ali Safavi, Jackie Hernandez, Saeed Amidi",[],0,[],0,[],0
Jim Breyer,[],0,[],0,[],0
"Brook Byers, Eugene Kleiner, Frank Caufield, Tom Perkins",[],0,[],0,[],0
Ronald Conway,[],0,[],0,[],0
"Ben Horowitz, Marc Andreessen",[],0,[],0,[],0
"Beat Schillig, Jordi Montserrat, Pascale Vonmont",[],0,[],0,[],0
Henry Phipps,[],0,[],0,[],0
"Beth Obermiller, Luke Antal, Michael Madden, Mike Collins",[],0,[],0,[],0
"Dave Lambert, Kevin Dick",[],0,[],0,[],0
Marta Antunez,[],0,[],0,[],0
"Barry Eggers, Christopher Schaepe, Peter Nieh, Ravi Mhatre",[],0,[],0,[],0
"David Bergmann, Martin Bodenham, Steven T. Stull",[],0,[],0,[],0
"David Fialkow, David Orfao, Joel Cutler",[],0,[],0,[],0
Chase Coleman,[],0,[],0,[],0
"David Rimer, Giuseppe Zocco, Neil Rimer",[],0,[],0,[],0
Vinod Khosla,[],0,[],0,[],0
Bill Maris,[],0,[],0,[],0
"Jeff Horing, Jerry Murdock",[],0,[],0,[],0
Don Valentine,[],0,[],0,[],0
"Marcus Goldman, Moritz Baier-Lentz, Tamin Pechet",[],0,[],0,[],0
"Charles Van Norman, Nicolás Shea",[],0,[],0,[],0
"Emily Melton, Josh Stein",[],0,[],0,[],0
Oliver Samwer,[],0,[],0,[],0
"Howard Morgan, Josh Kopelman, Todd Jackson",[],0,[],0,[],0
"Hany Nada, Joel Kellman, Scott Bonham, Thomas Ng",[],0,[],0,[],0
"Jeff Crowe, Jon Kossow, Promod Haque, Sohil Chand",[],0,[],0,[],0
"Bill Elfers, Daniel Gregory",[],0,[],0,[],0
Rick Frisbie,[],0,[],0,[],0
"Bill Biggerstaff, Robert Medearis, Roger V Smith",[],0,[],0,[],0
"Ken Howery, Luke Nosek",[],0,[],0,[],0
"Duane Kuang, Gary Rieschel",[],0,[],0,[],0
Laurance Rockefeller,[],0,[],0,[],0
"Bob Xiaoping Xu, Victor Wang",[],0,[],0,[],0
Alexander von Frankenberg,[],0,[],0,[],0
"Ajay Agrawal, Anthony Lacavera",[],0,[],0,[],0
"Alan Patricof, Dana Settle, Ian Sigalow",[],0,[],0,[],0
"Eric Young, Harry T. Rein",[],0,[],0,[],0
"Chaz Pratt, Henry DuBose Montgomery",[],0,[],0,[],0
"George Jones, Steve Stephansen",[],0,[],0,[],0
"Charles Chen, Chenye Xu, Jason Zeng, Pony Ma, Zhidong Zhang",[],0,[],0,[],0
"Brad Jones, Geoff Yang, John Walecka, Timothy Haley, Tom Dyal, Travis Bryant",[],0,[],0,[],0
"Darren Westlake, Luke Lang, Mac Parish, Oriol Cordón, Pepe Borrell",[],0,[],0,[],0
"Bill Elmore, Kathryn Gould",[],0,[],0,[],0
"Halsey Minor, Marc Benioff, Parker Harris",[],0,[],0,[],0
"Bo Shao, David Su, David Zhang, Yee Lee",[],0,[],0,[],0
"Jon Flint, mark jacobson, Steve Arnold, Terrance McGuire",[],0,[],0,[],0
"Andy Rachleff, Bob Kagle, Kevin Harvey",[],0,[],0,[],0
"Jeremie Berrebi, Xavier Niel",[],0,[],0,[],0
"Dave Salvant, Rick Burnes, Songe LaRon",[],0,[],0,[],0
Jose Marin,[],0,[],0,[],0
"John Burke, Jon Callaghan, Phil Black",[],0,[],0,[],0
Paul J. Ferri,[],0,[],0,[],0
Joseph J. Kinyoun,[],0,[],0,[],0
"David K. Chao, Dixon Doll, Hurst Lin",[],0,[],0,[],0
"Ben Lerer, Eric Hippeau, Ken Lerer",[],0,[],0,[],0
"KP Balaraj, Raj Dugar, Sandeep Singhal, SK Jain, Sumir Chadha",[],0,[],0,[],0
"James Robinson, Jim Robinson, Stuart Ellman",[],0,[],0,[],0
"James Nahirny, Michael Krupka",[],0,[],0,[],0
Luis Villalobos,[Villalobos],1,[],0,[],0
"Adam Rothenberg, David Tisch",[],0,[],0,[],0
Michiel de Haan,[],0,[],0,[],0
"Michael B. Sheffery, Sam Isaly",[],0,[],0,[],0
Ravi Belani,[],0,[],0,[],0
"Aydin Senkut, Dasha Maggio",[],0,[],0,[],0
Lisa Greenleaf,[],0,[],0,[],0
"Bill Bowes, David Liddle",[],0,[],0,[],0
"David Beatty, Paul Grossinger",[],0,[],0,[],0
"Aldo de Jong, Alex Farcet, Carsten Kolbek, Kalie Moore, Marc Wesselink, Patrick Zeeuw, Ruud Hendriks",[],0,[],0,[],0
"Batara Eto, Taiga Matsuyama, Willson Cuaca",[],0,[],0,[],0
"Dave Morin, Kevin Colleran, Sam Lessin, Scott Marlette, Will Quist",[],0,[],0,[],0
"Alex Finkelstein, Bijan Sabet, Paul Conway, Santo Politi, Todd Dagres",[Dagres],1,[],0,[],0
Troy Vosseller,[],0,[],0,[],0
"Alex Mittal, Boris Silver",[],0,[],0,[],0
"Cyril Ebersweiler, Jay Bullen, Saeid Masudy Panah, Sajjad Rimaz, Sean O'Sullivan, Sofia Bensily",[],0,[],0,[],0
"Reshma Sohoni, Saul Klein",[],0,[],0,[],0
"David Siemer, Eric Manlunas, Paul Santos",[],0,[],0,[],0
"John Sung Kim, Thomas G. McKinley, Vincent Worms",[],0,[],0,[],0
"Bob Higgins, Paul Maeder",[],0,[],0,[],0
"Alexis Ohanian, Garry Tan, Harjeet Taggar",[],0,[],0,[],0
Eyal Rabinovich,[],0,[],0,[],0
"Albert Ko, Aleksa Mitrović, Chizoba Anyaoha, Dilan Mizrakli Landgraff, Fridtjof Berge, Jay Gambaccini, Joe Benjamin, Joel Fredman Klockar, Jussi Salovaara, Magnus Grimeland, Michael Wendland, Nitin Sharma, Peter Barba, Sjoerd Geurts, Teo Ortega, Vegard Medbo",[],0,[],0,[],0
Paul E. Jacobs,[],0,[],0,[],0
Yasuhiko Yurimoto,[],0,[],0,[],0
Simon Thompson,[],0,[],0,[],0
Noel Fenton,[],0,[],0,[],0
Caroline Winnett,[],0,[],0,[],0
"Ben Gilbert, Gerald Grinstein, Greg Gottesman, Paul Goodrich, Tom Alberg, William Ruckelshaus",[],0,[],0,[],0
"Andy Palmer, Anthony Goldbloom, Bill Trenchard, Caterina Fake, Chris Dixon, Dan Sommer, David Frankel, Elliot Cohen, Eric Paley, Jack Groetzinger, James Tamplin, Micah Rosenbloom, Nadia Boujarwah, Noah Glass, Noah Jessop, Parul Singh, Raj De Datta, Zach Klein",[],0,[],0,[],0
"Jonathan Heiliger, Yoram Oron",[],0,[],0,[],0
"Matthew Ocko, Zachary Bogue",[],0,[],0,[],0
Kirill Varlamov,[],0,[],0,[],0
Junichi Masuda,[],0,[],0,[],0
"Eric M. Warburg, Lionel I. Pincus",[],0,[],0,[],0
Andrew Boszhardt Jr.,[],0,[],0,[],0
Jason Calacanis,[],0,[],0,[],0
"Eric Chin, Michael Stark, Sy Kaufman",[],0,[],0,[],0
William Lohse,[],0,[],0,[],0
"Jun Lei, Tuck Lye Koh",[],0,[],0,[],0
"Clinton Bybee, Keith Crandell, Robert Nelsen, Steven Lazarus",[],0,[],0,[],0
"Fritz Lanman, Hank Vigil",[],0,[],0,[],0
"Gene Barth, Scott Hedrick, Wally Hawley",[],0,[],0,[],0
"Akio Tanaka, Andreas Haug, Christian Leybold, Mathias Schilling, Thomas Gieselmann",[],0,[],0,[],0
"Ashley Carroll, Chamath Palihapitiya, Mamoon Hamid, Ted Maidenberg",[],0,[],0,[],0
"Gregory Avis, Roe Stamps, Stephen Woodsum",[],0,[],0,[],0
"Bill Geary, Doug Kingsley, Ed Anderson, Karen Keaney, Mike Pehl, Richard D'Amore",[],0,[],0,[],0
Christophe Baviere,[],0,[],0,[],0
"Josh Wolfe, Peter Hebert, Rob Paull",[],0,[],0,[],0
"Ben Li, Zhang Lei",[],0,[],0,[],0
Masayoshi Son,[],0,[],0,[],0
"Jason Pressman, Ravi Mohan, Rob Coneybeer, Tod Francis",[],0,[],0,[],0
Chuck Feeney,[],0,[],0,[],0
Andrew Edward,[],0,[],0,[],0
Ed Glassmeyer,[],0,[],0,[],0
"Feng Deng, Jeffrey Lee, Yan Ke",[],0,[],0,[],0
"Brad Burnham, Fred Wilson",[],0,[],0,[],0
Nengguang Wang,[],0,[],0,[],0
"Andrew Ryan, Nihar Patel, MBA, J.D., LLM, Travis Brodeen",[],0,[],0,[],0
"Jay Hoag, Rick Kimball",[],0,[],0,[],0
"Chip Hazard, Jeff Bussgang, Michael Greeley",[],0,[],0,[],0
"Joe Aragona, Ken DeAngelis",[],0,[],0,[],0
Jeff Clavier,[],0,[],0,[],0
"Steve Lebow, Steven Dietz, Yves Sisteron",[Sisteron],1,[],0,[],0
Stephen Page,[],0,[],0,[],0
Lars Langusch,[Lars],1,[],0,[],0
"Andrea T. Orlando, Cristobal Alonso, Herty Tammo, Jon Bradford, Mike Reiner",[],0,[],0,[],0
Peter Wendell,[],0,[],0,[],0
Stephen Welton,[],0,[],0,[],0
"David Bookspan, Elliot Menschik, Michael Levinson, Steve Welch",[],0,[],0,[],0
Ron Swenson,[],0,[],0,[],0
Andrew Yan,[],0,[],0,[],0
"Brad Feld, David Brown, David Cohen",[],0,[],0,[],0
"Arvind Gupta, Bill Liao, Sean O'Sullivan",[],0,[],0,[],0
"Alex Kolicich, Drew Oetting, Jake Medwell, Joe Lonsdale, Kimmy Scotti",[],0,[],0,[],0
Philippe Laffont,[],0,[],0,[],0
"Richard Lim, Sonny Wu",[],0,[],0,[],0
Reid Dennis,[],0,[],0,[],0
"Daniel Keiper-Knorr, Erik Bovee, Michael Schuster, Oliver Holle, Werner Zahnt",[],0,[],0,[],0
"Ann Miura-Ko, Mike Maples Jr",[],0,[],0,[],0
"Alice Bentinck, Ashish Jerry Justin, Claire Trant, Deepak Malhotra, Elizabeth Chan, Matt Clifford, Odero Otieno, Peter Farbey, Raffaele Colella, Rytis Jakubauskas",[],0,[],0,[],0
"Barbara Lubash, Brian Atwood, Donald B. Milder, Rebecca Robertson, Samuel Colella, William J. Link, William Link",[],0,[],0,[],0
"Andrew Castell, Paul Atkinson, Paul Munn, Robert Higginson",[],0,[],0,[],0
David Morgenthaler,[],0,[],0,[],0
"Robin Klein, Saul Klein",[],0,[],0,[],0
"John Frankel, Mariusz Adamski",[],0,[],0,[],0
"Brad Feld, Jason Mendelson, Ryan McIntyre, Seth Levine",[],0,[],0,[],0
"Steven Krein, Unity Stoakes",[Stoakes],1,[],0,[],0
"Amish Jani, Gerald Poch, Lawrence Lenihan, Rick Heitzmann",[],0,[],0,[],0
"Pam Omidyar, Pierre Omidyar",[],0,[],0,[],0
"Aharon Dovrat, Chemi Peres, Habib Hazzan, Rami Kalish",[],0,[],0,[],0
Tim Draper,[],0,[],0,[],0
"Anuj Khandelwal, Cameron Teitelman, Christopher Morace, Dan Ha, Jonathan Golden, Juan Vera, Karen Katz, Katie Fo, Matt Man, Richard Rabbat, Steve Petersen",[],0,[],0,[],0
"David Coats, Trevor Kienzle",[],0,[],0,[],0
"Christopher Lynch, Jeff Fagnan, Jon Karlen, Ryan Moore",[],0,[],0,[],0
Igor Ryabenkiy,[],0,[],0,[],0
"Charlie Kemper, Jonathan Axelrod, Murat Aktihanoglu",[],0,[],0,[],0
"Hua Wang, Lee Kai-Fu",[],0,[],0,[],0
"Elif Tutuk, Karen (Appleton ) Page, Michael Cardamone, Nick Mehta, Rowan Trollope",[],0,[],0,[],0
"Andreas Weiskam, David Hartwig, Doug Higgins, Jai Das, Nino Marakovic",[],0,[],0,[],0
"Joe Montana, Michael Ma, Mike Miller",[],0,[],0,[],0
"Andrew Frost, Arthur Dantchik",[],0,[],0,[],0
"Andy Sack, Erik Benson, Randall Lucas",[],0,[],0,[],0
"Mike Gordon, Paul Madera, Rob Ward",[],0,[],0,[],0
"Ajay Agrawal, Claudia Hepburn, Pavla Bobosikova, Reza Satchu, Rohan Jacob, Tim Hodgson",[],0,[],0,[],0
"Naren Gupta, Sandeep Singhal, Suvir Sujan",[],0,[],0,[],0
"Gigi Levy Weiss, James Currier, Pete Flint, Stan Chudnovsky",[],0,[],0,[],0
"Frank Artale, John Connors, Jonathan Roberts, Nick Sturiale",[],0,[],0,[],0
"Paul Wythes, William Draper",[],0,[],0,[],0
"Jonathan Medved, Steve Wishner",[],0,[],0,[],0
"Masayoshi Son, Oketani Taku",[],0,[],0,[],0
"Carlos Trenchs Sainz de la Maza, Randy Williams",[],0,[],0,[],0
Joshua Kushner,[],0,[],0,[],0
Thomas Price Jr.,[],0,[],0,[],0
John Malloy,[],0,[],0,[],0
"Bill Davidow, Lawrence G. Mohr Jr.",[],0,[],0,[],0
Jesse I. Treu,[],0,[],0,[],0
Lee Linden,[],0,[],0,[],0
Ken Woody,[],0,[],0,[],0
"Michael Arrington, Patrick Gallagher",[],0,[],0,[],0
"Ross Baird, Sean Foote, Victoria Fram",[],0,[],0,[],0
"Carlos Silva, Jeff Lynn",[],0,[],0,[],0
"Debbie Chang, Li Ka-shing, Solina Chau",[],0,[],0,[],0
Richard Aldrich,[],0,[],0,[],0
Houman Ashrafian,[],0,[],0,[],0
Kiyoshi Ichimura,[],0,[],0,[],0
"Daniel Tomov, Dilyan Dimitrov, Ivaylo Simov, Jon Bradford",[],0,[],0,[],0
"Karthik Reddy, Rob Blum, Sanjay Nath",[],0,[],0,[],0
"Benjamin Wilkening, Cem Sertoglu, Christian Nagel, Hendrik Brandis, Roland Manger, Rolf Mathies",[],0,[],0,[],0
Edward C. Johnson II,[],0,[],0,[],0
Linda Rottenberg,[],0,[],0,[],0
"Daniel A. D'Aniello, David Rubenstein, Shary Moalemzadeh, William E. Conway, Jr.",[],0,[],0,[],0
"Dan Levitan, Howard Schultz",[],0,[],0,[],0
Barry Silbert,[],0,[],0,[],0
Chris Arsenault,[],0,[],0,[],0
"Ansbert Gadicke, Luke Evnin",[],0,[],0,[],0
Jean Deleage,[],0,[],0,[],0
"David Marquardt, John Johnston",[],0,[],0,[],0
"Kate Mitchell, Rory O'Driscoll",[],0,[],0,[],0
Jerry Yang,[],0,[],0,[],0
Teruhide Sato,[],0,[],0,[],0
Jean Deleage,[],0,[],0,[],0
"Alan MacIntosh, Jean-Sebastian Cournoyer, John Stokes",[],0,[],0,[],0
"George R Roberts, Henry Kravis, Jerome Kohlberg, Ken Mehlman, Robert W. Antablin, Scott Nuttall",[],0,[],0,[],0
Nuno Afonso,[],0,[],0,[],0
"Brian Armstrong, Fred Ehrsam",[],0,[],0,[],0
Peter Brooke,[],0,[],0,[],0
"Kazuki Notsu, Keisuke Wada, Masahiko Homma, Tohru Akaura, Yusuke Murata",[],0,[],0,[],0
"Adam Corey, Anne Dwane, Ben Casnocha, Erik Torenberg, Ross Fubini",[],0,[],0,[],0
"Alastair Kilgour, Alun Williams, Enrico D'Angelo, Moray Wright, Neil Cameron",[],0,[],0,[],0
Tsuyoshi Ito,[],0,[],0,[],0
Charles Hipwood,[],0,[],0,[],0
"Han Kim, Ho Nam",[],0,[],0,[],0
"Ken Shi, Richard Liu",[],0,[],0,[],0
"Ara Fernezian, Laurence D. Fink, Robert S. Kapito, Sue Wagner",[],0,[],0,[],0
"Adam Draper, Brayton Williams",[],0,[],0,[],0
"Jean Fougerolles, Kieran Hill",[],0,[],0,[],0
"Cyril Ebersweiler, Sean O'Sullivan",[],0,[],0,[],0
"Amanda Liu, Anita Huang, Holly Harrington, Leroy Yau",[],0,[],0,[],0
"Alan Salzman, Jim Marver",[],0,[],0,[],0
Craig Shapiro,[],0,[],0,[],0
Jimmy Carter,[],0,[],0,[],0
"Nenad Marovac, Steve Schlenker",[],0,[],0,[],0
"Lip-Bu Tan, Roni Hefetz",[],0,[],0,[],0
"Fan Bao, Keyi Chen",[],0,[],0,[],0
"Cathy Zhang, Changwei Ma, Eddie Wu, Jack Ma, James Sheng, Jane Jiang, Jianhang Jin, Joseph Tsai, Lucy Peng, Min Han, Simon Xie, Tony Yiu, Toto Sun, Trudy Dai, Wensheng Lou, Yuanying Jin, Yuehong Zhou, Yufeng Shi",[],0,[],0,[],0
Chow Kiat Lim,[],0,[],0,[],0
"Anil Jain, Anuj Golecha, Apoorva Ranjan Sharma, Gaurav Jain",[],0,[],0,[],0
"Anne Glover, Hermann Hauser",[],0,[],0,[],0
Paul Allen,[],0,[],0,[],0
"Caribou Honig, Frank Rotman, Nigel Morris",[],0,[],0,[],0
"Cao Yi, Charlie Cao",[],0,[],0,[],0
"Donn Davis, Steve Case, Ted Leonsis, Tige Savage",[],0,[],0,[],0
Ullas Naik,[],0,[],0,[],0
"Bin Yue, Xiang Gao, Zhen Zhang",[],0,[],0,[],0
Steve Case,[],0,[],0,[],0
"Garrett Gruener, Guy P. Nohra, Jean Deleage",[],0,[],0,[],0
"Edwin Kania, Noubar Afeyan, Thomas de Vlaam",[],0,[],0,[],0
Juan Roig,[],0,[],0,[],0
"Ariel Arrieta, Gonzalo Costa, Marta Cruz",[],0,[],0,[],0
Norman R. Augustine,[],0,[],0,[],0
"John Cadeddu, Tom Goodrich",[],0,[],0,[],0
Lak Ananth,[],0,[],0,[],0
"Felix Zhang, Gilles Planté, Jeremy Colless, John McCartney, Luke Fay, Matthew Clunies-Ross",[],0,[],0,[],0
"Hossein Rahnama, Sheldon Levy",[],0,[],0,[],0
"Freada Kapor Klein, Mitchell Kapor",[],0,[],0,[],0
"Bjorn Stray, Ingar Ostby, Karl-Christian Agerup, Tellef Thorleifsson",[],0,[],0,[],0
"Chi-Hua Chien, Eric J. Kim",[],0,[],0,[],0
"Sanjay Subhedar, Tae Hea Nahm",[],0,[],0,[],0
"David Norwood, Michael Burychka",[],0,[],0,[],0
"Hadley Harris, Nihal Mehta, Tim Young, Vic Singh",[],0,[],0,[],0
James Flynn,[],0,[],0,[],0
Elon Boms,[],0,[],0,[],0
Hirofumi Kondo,[],0,[],0,[],0
Karin Klein,[],0,[],0,[],0
R. Chadwick Paul,[],0,[],0,[],0
"Christoph Janz, Kolja Hebenstreit, Lukasz Gadowski, Pawel Chudzinski",[],0,[],0,[],0
"Avi Zeevi, Shlomo Dovrat",[],0,[],0,[],0
Paul Grand,[],0,[],0,[],0
Argeris Karabelas,[],0,[],0,[],0
"John Lindfors, Rahul Mehta, Saurabh Gupta, Tom Stafford, Yuri Milner",[],0,[],0,[],0
Edward W. Kane,[],0,[],0,[],0
Isabelle de Cremoux,[],0,[],0,[],0
"Clint Korver, Miriam Rivera",[],0,[],0,[],0
John Martinson,[],0,[],0,[],0
Anis Uzzaman,[],0,[],0,[],0
Charles Hudson,[],0,[],0,[],0
"Adam Said, Charles Lorenceau, Christopher Kile, Sherif El Halwagy",[],0,[],0,[],0
Ram Jambunathan,[],0,[],0,[],0
"Chun Xia, Eugene Zhang",[],0,[],0,[],0
Erel Margalit,[],0,[],0,[],0
Michael Lake,[],0,[],0,[],0
"Florian Schweitzer, Hermann Arnold, Jan Bomholt, Nicole Herzog, Peter Troxler, Philip Schnedler",[],0,[],0,[],0
"Rory Moore, Walter Davis",[],0,[],0,[],0
"J.B. Pritzker, Tony Pritzker",[],0,[],0,[],0
"Bill Lee, David O. Sacks, Jeff Fluhr",[],0,[],0,[],0
Yat Siu,[Siu],1,[],0,[],0
Amit Garg,[],0,[Amit],1,[],0
"Ann Winblad, John Hummer",[],0,[],0,[],0
Hans Thomas,[],0,[],0,[],0
"Aviad Eyal, Martin Moshal",[],0,[],0,[],0
Kirsten Green,[],0,[],0,[],0
"George Spencer, T. Bondurant French",[],0,[],0,[],0
Brian Mac Mahon,[],0,[],0,[],0
Rolf Christof Dienst,[],0,[],0,[],0
Paul Taylor,[],0,[],0,[],0
"Amy Nauiokas, Nadeem Shaikh, Sean Park",[],0,[],0,[],0
"Brian Jacobs, Gordon Ritter, Jason Green",[],0,[],0,[],0
Joel Peterson,[],0,[],0,[],0
"Alan Patricof, Ronald Cohen",[],0,[],0,[],0
Alan D. Frazier,[],0,[],0,[],0
"David Blumberg, Ilia Shnaidman",[],0,[],0,[],0
Kate Methuen-Ley,[],0,[],0,[],0
"Dean G. Witter, Harold Stanley, Henry Sturgis Morgan, Richard S. Reynolds, Vincent Lupo",[],0,[],0,[],0
"Alexander Samwer, Jeremias Heinrich, Robin Godenrath",[],0,[],0,[],0
"Jiao Shuge, Wang Lin Ph.D, Zhenyu Wang",[],0,[],0,[],0
Wei Chen,[],0,[],0,[],0
"Dror Berman, Eric Schmidt, Rick Scanlon, Yuval Shachar",[],0,[],0,[],0
"Erik Rannala, William Hsu",[],0,[],0,[],0
"Eric Acher, Fabio Igel",[],0,[],0,[],0
Joseph Edelman,[],0,[],0,[],0
Ashton Newhall,[],0,[],0,[],0
Tom Walker,[],0,[],0,[],0
"Ash Patel, Michael Marquez",[],0,[],0,[],0
Michael Dearing,[],0,[],0,[],0
Staffan Helgesson,[],0,[],0,[],0
"Ashwath Nagaraj, Dmetrius White, Leonard Bosack, Robert Hubbard, Sandy Lerner",[],0,[],0,[],0
Liu Zhou,[],0,[],0,[],0
"Ben Rosen, L.J. Sevin",[],0,[],0,[],0
"Donald Dixon, John Moragne",[],0,[],0,[],0
"Mitch Kitamura, Q Motiwala, Tetsujiro Nakagaki",[],0,[],0,[],0
"Manuel A. Henriquez, Roy Y. Liu, Scott Harvey",[],0,[],0,[],0
Vani Kola,[],0,[],0,[],0
Lance Laking,[],0,[],0,[],0
"Andy Weissman, Billy Chasen, John Borthwick",[],0,[],0,[],0
"Dennis Beard, Rob Schultz, Stephen Beck, Tim Hoerr",[],0,[],0,[],0
"Jackson Cummings, Van Jones, Walter L. Morgan",[],0,[],0,[],0
"Bill Gates, Melinda Gates",[],0,[],0,[],0
"David Beisel, Lee Hower, Rob Go",[],0,[Go],1,[],0
"Bin Lin, Chuan Wang, De Liu, Feng Hong, Guangping Zhou, Jiangji Huang, Jun Lei, Kong-Kat Wong, Wanqiang Li",[],0,[],0,[],0
Niklas Zennström,[],0,[],0,[],0
David Hirsch,[],0,[],0,[],0
Ulla Brockenhuus-Schack,[Schack],1,[],0,[],0
"Howard Marks, Paul Kessler, Ronald Miller",[],0,[],0,[],0
"Sanjay Jha, Shanti Mohan",[],0,[],0,[],0
Ting Gootee,[],0,[],0,[],0
"Mar Hershenson, Pejman Nozad",[],0,[],0,[],0
Steve Anderson,[],0,[],0,[],0
H. Haight,[],0,[],0,[],0
Meyer Malka,[],0,[],0,[],0
"Bill Bartee, Larry Marshall, Niki Scevak, Richard Baker",[],0,[],0,[],0
Dan Morehead,[],0,[],0,[],0
Ben Hurley,[],0,[],0,[],0
Eli Casdin,[],0,[],0,[],0
Shichun Wu,[],0,[],0,[],0
Ramtin Naimi,[],0,[],0,[],0
"Haiyan Wu, Ning Tang",[],0,[],0,[],0
Tarana Lalwani,[],0,[],0,[],0
"Charles Letourneur, Guillaume Aubin",[],0,[],0,[],0
"Alex Zheng, Huang Li",[],0,[],0,[],0
"Edward Lando, Jon Oringer, Nadav Ben-Chanoch",[],0,[],0,[],0
Joel Marcus,[],0,[],0,[],0
Alain Caffi,[],0,[],0,[],0
Robert Adelson,[],0,[],0,[],0
"Hernan Kazah, Nicolas Szekasy",[],0,[],0,[],0
"Jeffrey A Shaw, Jim Coulter, Kelvin L. Davis, William S. Price",[],0,[],0,[],0
"Kevin Kearns, Michael McMahon, Sach Chitnis",[],0,[],0,[],0
Anri Samata,[],0,[],0,[],0
Gavin Christensen,[],0,[],0,[],0
"Jody Shepherd, Noah Pittard",[],0,[],0,[],0
"Marco Zeller, Roger Bendisch",[],0,[],0,[],0
Alphonse Desjardins,[],0,[],0,[],0
"Andrew Goldfarb, Barry Schiffman",[],0,[],0,[],0
"Chad Byers, Leo Polovets, Seth Berman",[],0,[],0,[],0
"Manik Arora, Sudhir Sethi, TC Meenakshisundaram",[],0,[],0,[],0
"Brian Matthews, Cliff Holekamp, Jim McKelvey, Kyle Welborn, Peter Esparrago, Rick Holton, Jr.",[],0,[],0,[],0
Paul Miller,[],0,[],0,[],0
Yi-Jian Ngo,[],0,[],0,[],0
Ana Querido Rita,[],0,[],0,[],0
"Andrew Gu, Shoucheng Zhang",[],0,[],0,[],0
"James B. Murray, Jr.",[],0,[],0,[],0
"Dan Armbrust, Joe Kirgues, Jon Eckhardt, Troy Vosseller",[],0,[],0,[],0
"Simon Cook, Stuart Chapman",[],0,[],0,[],0
"Andy Appelbaum, Mitch Rubin, Morty Schaja, Wayne Powell",[],0,[],0,[],0
"Prashant Choksey, Praveen Chakravarty",[],0,[],0,[],0
"Barbara S. Schilberg, Gregory Harriman",[],0,[],0,[],0
"James Han, Ryan Feit",[],0,[],0,[],0
Jon Saari,[],0,[],0,[],0
"An Nguyen, CeCe Cheng, Josh Kopelman, Phin Barnes",[],0,[],0,[],0
John Friedenrich,[],0,[],0,[],0
Jean-Marc Bally,[],0,[],0,[],0
"Bjorn Brekel, Don Ritzen, James Digby, Koen Wagemakers, Oscar Kneppers, Rune Theill, Susana Arévalo",[],0,[],0,[],0
"Adrian Fenty, Charles King, Marlon Nichols, Michael Palank",[],0,[],0,[],0
"Chris Sacca, Crystal Sacca",[],0,[],0,[],0
"Lukas Weber, Steffen Wagner",[],0,[],0,[],0
Rob Ness,[],0,[],0,[],0
Frank Adams,[],0,[],0,[],0
Faisal Khan,[],0,[],0,[],0
"Li Wei, Liu Hao",[],0,[],0,[],0
"Alan Morgan, Bruce Macfarlane",[],0,[],0,[],0
"Avnish Bajaj, Rishi Navani",[],0,[],0,[],0
Thomas Tsao,[],0,[],0,[],0
"Jerry Schlichter, Joe Schlafly",[],0,[],0,[],0
"Keith Titan, Urs Cete",[],0,[],0,[],0
"Alain Chuard, Larry Page, Scott Tierney, Sergey Brin, Wesley Chan",[],0,[],0,[],0
"Alex Frolov, Yaron Valler, Yaron Valler",[],0,[],0,[],0
"Bill Wood, Morgan Flager",[],0,[],0,[],0
Peter Liu,[],0,[],0,[],0
Peter Yan,[],0,[],0,[],0
"Hany Nada, Scott Stanford",[],0,[],0,[],0
Brian Paul,[],0,[],0,[],0
"Andrew Busey, Bill Boebel, Bryan Menell, Gordon Daugherty, Joshua Baer, Sam Decker",[],0,[],0,[],0
Bihua Chen,[],0,[],0,[],0
"Adam Carver, Jenny Fielding, Katie Hunt, Matthew Brimer, Scott Hartley",[],0,[],0,[],0
"Aviad Ariel, David Heller, Emanuel Timor, Ran Gartenberg, Yanai Oron, Yoram Oron",[],0,[],0,[],0
Tom Weithman,[],0,[],0,[],0
"Bob Goldberg, Dale Stinton",[],0,[],0,[],0
"Craig Taylor, John Shoch",[],0,[],0,[],0
Kevin Kinsella,[],0,[],0,[],0
Sam Bankman-Fried,[],0,[],0,[],0
Carine Magescas,[],0,[],0,[],0
"David Mott, Edward Mott",[],0,[],0,[],0
Robert Spencer,[],0,[],0,[],0
"Bill Gates, Paul Allen, Scott Armanini",[],0,[],0,[],0
"Eduardo Saverin, Howard Morgan, Raj Ganguly",[],0,[],0,[],0
Masayoshi Son,[],0,[],0,[],0
"Bradley Keywell, Eric Lefkofsky",[],0,[],0,[],0
"Bill McAleer, Enrique Godreau",[],0,[],0,[],0
Zach Ware,[],0,[],0,[],0
Julien Bourrellis,[],0,[],0,[],0
"Ambar Bhattacharyya, David Singer, Lee Ainslie, Matthew Kinsella",[],0,[],0,[],0
"Edgar G. Engleman, Frank Kung",[],0,[],0,[],0
"Hunter Walk, Satya Patel",[],0,[],0,[],0
"John Pierpont Morgan, John Thompson",[],0,[],0,[],0
"John Albright, Kevin Talbot",[],0,[],0,[],0
Raymond Debbane,[],0,[],0,[],0
"Alexander Rosen, Pat Kenealy, Phil Sanderson",[],0,[],0,[],0
Nathan McDonald,[],0,[],0,[],0
"Mendel Chuang, Samantha Quist",[],0,[],0,[],0
"Ashton Kutcher, Guy Oseary",[],0,[],0,[],0
"Bethann Kassman, Brigitte Baumann",[],0,[],0,[],0
Semil Shah,[],0,[],0,[],0
"Kirill Sheynkman, Leonid Boguslavsky",[],0,[],0,[],0
"Chris Farmer, Ilya Kirnos, Jerry Ye",[],0,[],0,[],0
"James Niedel, Jeani Delagardelle, Philippe Chambon, Vijay Lathi",[],0,[],0,[],0
Angela Jackson,[],0,[],0,[],0
Debby Hopkins,[],0,[],0,[],0
"Peter G. Peterson, Stephen Schwarzman",[],0,[],0,[],0
"Rupert H. Johnson, Sr.",[],0,[],0,[],0
"Alex Bogusky, Jack Donenfeld, Jose Vieitez, Kyle Groth, Toby Krout",[],0,[],0,[],0
Fausto Boni,[],0,[],0,[],0
David S. Rose,[],0,[],0,[],0
Christophe Maire,[],0,[],0,[],0
"Alok Mittal, Padmaja Ruparel",[],0,[],0,[],0
Marc Stad,[],0,[],0,[],0
"Anton Waitz, Ben Fischer, Christian Weiss, Florian Heinemann, Thies Sander, Uwe Horstmann",[],0,[],0,[],0
"Larry Begley, Liam Donohue, Maria Cirino",[],0,[],0,[],0
"Leonard Bosack, Sandy Lerner",[],0,[],0,[],0
J. Everett Allen’s,[],0,[],0,[],0
"Andrew Schwab, John Diekman",[],0,[],0,[],0
Viktoriya Tigipko,[],0,[],0,[],0
Greg Sands,[],0,[],0,[],0
Sunil Dhaliwal,[],0,[],0,[],0
"Chris Hollenbeck, Jackie Berterretche, Standish O'Grady",[],0,[],0,[],0
"Mark Esiri, Tom Fleming",[],0,[],0,[],0
"Adanne Branch, Josep María Echarri, Roger Piqué Pijuan",[],0,[],0,[],0
"Anthony Montagu, Peter Dicks",[],0,[],0,[],0
Nick Lewis,[],0,[],0,[],0
"Cameron Lester, Mike Kwatinetz, Paul Ferris, Paul Weinstein",[],0,[],0,[],0
"Ben White, Chris Tottman, Ian Milbourn, Jos White, Stephen Chandler",[],0,[],0,[],0
Marnie LaVigne,[],0,[],0,[],0
"Adam Cragg, Brandon Maier, Chad Burgess, Glenn Argenbright",[],0,[],0,[],0
"Paul Martino, Richard Melmon",[],0,[],0,[],0
Josh Cohen,[],0,[],0,[],0
"Michael Hirshland, Raanan Bar-Cohen",[],0,[],0,[],0
"Guy Turner, Ira Weiss",[],0,[],0,[],0
"Kent Madsen, Nick Efstratis, Todd Stevens",[],0,[],0,[],0
Steve Booth,[],0,[],0,[],0
"Hans Swildens, Tom Litle",[],0,[],0,[],0
"Dennis Dougherty, Roy Rodwell",[],0,[],0,[],0
"James O'Connor, Matthew Growney, Warren Holtsberg",[],0,[],0,[],0
Ryan Bloomer,[],0,[],0,[],0
"Christian Meermann, Daniel Glasner, Filip Felician Dames",[],0,[],0,[],0
Yi Shi,[],0,[],0,[],0
"Balthazar de Menthon, Charles Degand",[],0,[],0,[],0
James Bochnowski,[],0,[],0,[],0
"John Gardner, Paul Asel",[],0,[],0,[],0
Jihoon Rim,[],0,[],0,[],0
Olaf Carlson-Wee,[],0,[],0,[],0
Antonio Gracias,[],0,[],0,[],0
"Benjamin Sun, Brad Svrluga, Harrison Kratter, Melanie Tam",[],0,[],0,[],0
"Charles Noell, Harry Gruner",[],0,[],0,[],0
Ed Sim,[],0,[],0,[],0
"Bob Greene, Matt Gorin",[],0,[],0,[],0
"Christian Jepsen, Jimmy Nielsen",[],0,[],0,[],0
"Anil Jain, Anuj Golecha, Apoorva Ranjan Sharma, Gaurav Jain",[],0,[],0,[],0
Kenneth L. Turner,[],0,[],0,[],0
"Anna Patterson, Zachary Bratun-Glennon",[],0,[],0,[],0
"Calum Paterson, Gary Le Sueur, Stuart Paterson",[],0,[],0,[],0
"Francois Veron, Patrick Malka",[],0,[],0,[],0
"Bernard Daugeras, Jacques Chatain, Patrick Bamas",[],0,[],0,[],0
"Eileen Burbidge, Robert Dighero, Stefan Glänzer",[],0,[],0,[],0
"Atul Kamra, Brian Matthews, Jim McKelvey",[],0,[],0,[],0
"Dominic Perks, Rupert Hambro",[],0,[],0,[],0
"Michael Mao, Yi Pin Ng",[],0,[],0,[],0
"Babak Poushanchi, Bobby Yazdani, Ullas Naik",[],0,[],0,[],0
"Elizabeth Yin, Eric Bahn",[],0,[],0,[],0
"Ambassador Clifford Sobel, Scott Sobel",[],0,[],0,[],0
John L. Cassis,[],0,[],0,[],0
Matt Cheng,[],0,[],0,[],0
"Alexey Girin, Anastasia Lykova, Katya Kohen, Serge Milman, Sergey Vasilev",[],0,[],0,[],0
"Jim Dugan, John Dugan, Peter Ianello",[],0,[],0,[],0
"Hans-Jurgen Schmitz, Mark Tluszcz",[],0,[],0,[],0
"Chad Boeding, Divesh Makan, Michael Anders",[],0,[],0,[],0
"David Samuel, Josh Felser",[],0,[],0,[],0
"Bernard Fairman, Peter English",[],0,[],0,[],0
William Randolph Hearst,[],0,[],0,[],0
"Harry Yu, Min Zhang",[],0,[],0,[],0
Yida Gao,[],0,[],0,[],0
Thomas Sutherland,[],0,[],0,[],0
"Hjalmar Winbladh, Kees Koolen, Lars Jörnow",[],0,[],0,[],0
"Florian Hagenbuch, Julio Vasconcellos, Marcos de Toledo Leite, Mate Pencz, Patrick de Picciotto",[],0,[],0,[Florian],1
